サークル名 (Circle),"ふりがな (Circle, phonetically)",URL,ジャンル (Genre),Vocal,主な頒布CD (Album),原曲アレンジの程度 (?),一言
っ´Д｀)っゼロ式の処刑場（っ´Д｀)っゼロ式の家・DESTRUCTIVE ANGEL）,ぜろしきのしょけいじょう,http://shinzanzeroshiki.fc2web.com/,メタル,男,Crazy Trancy Ecstasy,原曲維持,重厚感あふれる荘厳なメタル。（Black）
α music,あるふぁみゅーじっく,http://www19.atpages.jp/tatu4/,オーケストラ、ピアノ,,東方風水華月,原曲維持,
凸凹えんたーていめんとすたじお,でこぼこえんたーていめんとすたじお,http://3rd.geocities.jp/deko_boko_es/index/,リコーダー、ゲームミュージック,,Electronic Magus,原曲維持,8ビットあり、リコーダー生演奏ありと多彩。（Black）
[4989],しくはっく,http://4989mm.littlestar.jp/,ロック,男女,musick for me,原曲維持,スローなロック風アレンジにハイトーン男声ボーカル、エレクトロも混ざったインストも。ドラマCDあり。（Black）
[ kapparecords]),かっぱれこーず,http://www5f.biglobe.ne.jp/~kapparecords/,ハードロック,男,SCARLET FANTASIA,原曲維持,生演奏ギタードラムベースと男声ボーカルがんばれ。（Black）
＜echo＞PROJECT,えこぷろじぇくと,http://echoproject.3rin.net/,ダンス、ポップス、ロック,女,eclat:,原曲重視～維持,女性ボーカルを軸にしてジャンルは何でもアレンジ。（Black）
#039,しゃーぷさんきゅー,http://sharp039.web.fc2.com/,,,EMERGENCE,,
#ゆうかりんちゃんねる,ゆうかりんちゃんねる,http://yuukach.web.fc2.com/,オーケストラ、クラシック、ピアノ、エレクトロ、ロック,,ゴリラ人間のための華麗なる大幻想曲集,原曲維持,クラシカルな構成と管弦を散りばめたオーケストラ、クラシック風インスト。バイオリンの倍音の響きが印象的。（Black）
10-GALLON(Digit Smith),てんがろん,http://10-gallon.net/,ロック、エレクトロ、ハードロック,女,悪魔城レミリア,原曲維持,原曲メロをミドルテンポなロックとエレクトロに乗せて。（Black）
刹那パラドックス(２☆),せつなぱらどっくす,http://coo.xii.jp/tsuki/2star/,ハードコア,,魔境ﾃﾞｨｽﾄ-ｼｮﾝ,原曲維持～破壊,ネタ曲多めなハーコーアレンジ。（鰻）
1211,いちにいちいち,http://1211.ya-gasuri.com/,ロック,男,百景,原曲維持,聞いて心地よい男性ボーカルと、早い曲調がマッチしていると感じる(鰻)
2nd Flush(右京屋),せかんどふらっしゅ,http://2ndflush.web.fc2.com/,テクノ、トランス,,existence,原曲維持,淡々と進むシンプルなテクノトランスに時間が過ぎる。（Black）
2SP+C'K,つーえすぴーしーけー,,エレクトロニカ,,STAR FRUIT,原曲維持～破壊,ふうわりとした電子癒し系よろずジャンル。（Black）
3/2,いってんご,http://gba9999.web.fc2.com/toppage.html,テクノ、エレクトロ、ロック,,冷やし中華始めました～夏限定～,原曲維持,ノンジャンルだがまとまったインストアレンジ。（Black）
38beets ,さんぱちびーつ,http://38beetsblog.blog67.fc2.com/,トランス,女,PIECES,原曲維持,シンプルな直球トランスに時々女性ボーカル。（和泉）
3S Cubic,さんえすきゅーびっく,http://3s-cubic.com/,ダンス、テクノ,女,地平線のむこう側へ,原曲維持,シンプルなダンス系四つ打ち。（Black）
404 Not Founds,よんまるよんのっとふぁうんど,http://404notfounds.yukimizake.net/,バンドアレンジ,男,カミカゼファンタジア,原曲重視～維持,ギターとドラムの昔ながらのバンドにボーカル。拙くも味がある。（Black）
5150,ごういちごうまる,http://ryu-5150.jp/,メタル,男,シンフォニック東方,原曲維持,ギターとシンセと細かいビートでかっ飛びたい人向け。（Black）
556mm,ごひゃくごじゅうろくみりめーとる,http://556mm.blog136.fc2.com/,トランス、ハードコア、テクノ,女,passion -Dancing Battle Girls-,原曲維持,スタンダードなトランス、ハードコアのメロに乗せた女声ボーカル。（Black）
57,ふぃふてぃせぶん,http://fiftyseven.blog71.fc2.com/,ロック,女,東方ギターロックボーカルアレンジCD　1st demo,原曲維持,荒削りなギターロックに女声ボーカル。（Black）
72hPa,ななじゅうにへくとぱすかる,http://72hpa.web.fc2.com/,,,デモCD,,
9bFOX,きゅーびーふぉっくす,http://9bfox.blog20.fc2.com/,ロック,男,Birth of the Chain,原曲維持,メロコア生演奏が楽しそう。（和泉）
⑨いんてっと,くいんてっと,http://9tet.com/,テクノ、エレクトロ、ロック、ハードコア,女,In The Court Of The Scarlet Devil,原曲維持,打ち込み系による多彩なアレンジが飽きさせない。（和泉）
⑨ウリバタケ,きゅうりばたけ,http://www.9uri.com/,バンドアレンジ,男女,いろは道中,原曲維持,ギターとドラムのシンプルなバンドアレンジにボーカル。（Black）
A.S.C.Y.,えー・えす・しー・わい,,シンセ、ロック、テクノ,,EASTERN GREEN MILE,原曲維持,多彩なシンセ系アレンジが飽きさせない。（Black）
Abandoned Antique Moon Faktoria,あばんどーんｄあんちきゅーもーんふぁくとりあ,http://blog.livedoor.jp/moon_faktoria/,,,Ageless Adore,,
acrophobia,あくろふぉびあ,http://acrophobia.yaekumo.com/,ロック,男,red buzz,原曲維持,ヘビーなメロとエレキギターのリフが唸るロックアレンジに男声ボーカル。（Black）
activity,あくてぃびてぃ,http://activity.sakura.ne.jp/,ロック,男,twintail+,原曲維持,シンプルなロックサウンドに枯れた男声ボーカルの手作り感。（Black）
Acute Strings,あきゅーとすとりんぐす,http://adanchsa.blog13.fc2.com/,ロック,,Fragment of Visions,,
ad libitum records,あどりぶれこーず,,トランス,,玄海秋桜,原曲維持,ひと捻り加えたトランスアレンジは面白い。（Black）
Aftergrow,あふたーぐろう,http://aftergrow12.web.fc2.com/,ロック,男女,color of soundscape,原曲維持,華やかなギターとドラム。ボーカルがんばれ。（Black）
AGENT 0,えーじぇんとぜろ,http://hp.xxxxxxx.jp/agent0/,メタル、ハードロック,男,ultima weapon ,原曲維持～破壊,かっ飛ぶリフとドラムにデスメタルボイスがカオス。（和泉）
A-HEAD,あへっど,http://a-head.cc/,ロック,男女,籠リ謳,原曲維持,ギターメインのストレートなアレンジ。時々ボーカル。（Black）
AIR WINDOW,えあうぃんどう,http://www3.ocn.ne.jp/~airwind/,テクノ、ハウス,,夢幻少女の祈る夜,原曲維持,色々なジャンルで華はなくも凝らしたアレンジ。（Black）
AkibaratyLabo.,あきばらてぃらぼ,http://akibaraty.blog97.fc2.com/,ドラマCD,,東方恋録抄　Remember The Time,,
Aleile,あれいる,http://aleile.com/,テクノ、エレクトロ、クラシック,,Beauteous Rain,原曲維持,ゆったりと幻想的な構成が印象的。（Black）
Alice Music,ありすみゅーじっく,http://alicemusic.ciao.jp/,ロック,男女,Masterpiece,原曲維持,ギターとシンセの基本王道ロックに厚めの女性ボーカル。（Black）
ALICE:made ,ありすめいど,http://alicemade.web.fc2.com/,ロック、オルゴール,男女,ALICE'S EVIDENCE ,原曲維持,
ALiCE'S EMOTiON,ありすずえもーしょん,http://redalice.net/,ハードコア、トランス,女,SCARLET EYES,原曲維持～破壊,高速重低音ハードコアの技術はピカイチ。（Black）
Alluvial Comet,あるーう゛ぃおこめっと,http://alluvialcomet.web.fc2.com/,ロック,,Magic Rock Field,原曲維持,シンプルなギターがうねりじっくりと聴かせるインスト。（Black）
Alnair Musica,あるないるむーじか,http://alnairgiocato228.blog90.fc2.com/,ロック、オーケストラ,,Transient Dreamers -ver. Eternal Reminiscence-,原曲維持,シンプルで軽やかなロックインスト、静かなオーケストラアレンジ。（Black）
AlphaVersion Records,あるふぁばーじょんれこーづ,http://avr.ninja-web.net/,,,The AlphaVersion Records ,原曲維持,
Alstroemeria Records,あるすとろめりあれこーず,http://www.alst.net/,ダンス、トランス,女,Lovelight,原曲維持～破壊,高水準の技術に女性ボーカルの安定度は抜群。（Black）
ALTERNATIVE,おるたなてぃぶ,,ジャズ、メタル、ボーカロイド,,Twilight Symphony,原曲維持,アルバムごとにアレンジャーが変わり多彩。（Black）
AmaterasRecords ,あまてらすれこーず,http://amateras-records.com/,トランス、テクノ、エレクトロ、ポップス,女,Artifact,原曲維持,スタンダードなテンポよい四つ打ちに女声ボーカル。（Black）
Analyze -,あならいず,http://scottishfold.hp2.jp/,ハードロック,,ENDLESS WINTER,原曲維持,ギターメインの王道ハードロック。（Black）
ANARQIE Records,あなーきーれこーず,http://anarqierecords.com/,ポップス、エレクトロ、ロック,女,みんなの東方リミックス   ,原曲維持～破壊,ポップで明るいヴォーカル曲が印象的。（鰻）
AncientChronicle,えいんしぇんとくろにくる,http://ac.udonge.net/,テクノ、エレクトロ,,夢幻月光 - Drastic Preterite.Comments,原曲重視,原曲に忠実に雰囲気を残した打ち込みアレンジ。（和泉）
And-of-world,えんどおぶわーるど,http://aoworld.blog69.fc2.com/,ロック、バンド,男女,memento,原曲重視,ギターメインのバンドアレンジに男声ボーカル。（Black）
AniPix,あにぴくす,http://www.anipix.info/,デジタルロック,女,Rectia,原曲維持,安定した技術に多彩なジャンルは聞いてて飽きさせない。（Black）
Anisakis simplex,あにさきすしんぷれっくす,http://anisakissimplex.blog96.fc2.com/,テクノ、エレクトロ,男女,零期感染,原曲維持,素直なピアノメインのアレンジ。男声ボーカルは伸び伸び。（Black）
A-One,えーわん,http://a-one-records.com/,ダンス、ポップス、ロック,女,DYSTOPIA,原曲維持～破壊,技術的に十分なよろずアレンジに安定したボーカルは手堅い。（Black）
Aphrodite Symphonics,あふろでぃーてしんふぉにっくす,http://www5f.biglobe.ne.jp/~kapparecords/,ハードロック,女,THE NINTH GATE of SCARLET FANTASIA,原曲維持～破壊,王道ハードロックの激しいギターさばきに力強い女性ボーカル。（Black）
Applice,あぷりす,http://applice.com/,オーケストラ、エレクトロ,,Fantasía de Conciertos,原曲維持,オケアレンジにいろいろな音を入れて飽きさせない。（Black）
AQUAELIE,あくあえりー,http://www.k4.dion.ne.jp/~aquaelie/,メタル,,神速裁判 ～ Rapidity is a justice,原曲維持～破壊,超疾走のギターの奔流に巻き込まれていく。（和泉）
AQUARIA MUSICS,あくありあみゅーじっくす,http://members.jcom.home.ne.jp/suiden/,ロック,,恐怖の幻想改革,原曲維持～破壊,プログレロックのギターとオルガンが多彩な世界。（Black）
AQUASTYLE,あくあすたいる,http://www.aquastyle.org/,シンセ、テクノ,,東方奇闘曲,原曲重視,ジャンルを問わない多様なアレンジ。（Black）
Archaic Air ,あーけいっくえあー,http://karisuwaya.gamagaeru.jp/,,,Chronus Record,,
ARIACROWN,ありあくらうん,http://ariacrown.web.fc2.com/,ロック,男,東方紅蓮月,原曲維持,ひねり気味のダークでスロウなロックアレンジが少し粗いが、ボコーダー的なエフェクトを味付けた男声ボーカルが面白い。（Black）
AriaRhythm,ありありずむ,http://karisomeno.web.fc2.com/,ロック、ポップス,男,彼女と星の唄,原曲維持,軽めのロックに男声ボーカル。（Black）
Ark of Phantasm,あーくおぶふぁんたずむ,http://gkf.sakura.ne.jp/winna/blog/,ロック、テクノ,,glide,原曲破壊,ミドルテンポのエレキギターがメインのロック風味。（Black）
ARMのArmageddong Records,えーあーるえむのあるまげどんれこーず,http://armageddon-records.com/,プログレ、テクノ、エレクトロ,女,東方メリーゴーランド,原曲維持,IOSYSのアレンジャーARM氏の個人サークル。メロトロンオンリーのレトロなプログレッシブ・ロックアレンジ。メロトロン好きにはたまらないだろう。（Black）
Art Book Chipika,あーとぶっくちぴか,http://www.abchipika.jp/,テクノ、エレクトロ,,東方極光天 ～ Sky Lights,原曲維持,軽やかなミッドテンポのエレクトロがリラックスさせる。（Black）
Arte Refact,あるてりふぁくと,http://www.arte-refact.com/,ロック、テクノ、ポップス,女,幻想遊園郷 - Fantastic Park -,原曲重視～維持,有名サークルによる合同音楽サークル。ヴォーカルメイン(イール)
as qool as qucumber,あずくーるきゅーかんばー,http://acacmizu.blog130.fc2.com/,テクノ、エレクトロ、エレクトロニカ,,夢幻現想ディザテーション,原曲維持,聞きやすく、丁寧な印象を受ける。(UR)
As/Hi,あすはい,http://as-hi.smat.ne.jp/,ハードロック,男,Rapid Ensemble,原曲維持,ロック風味のかなり技術を凝らしたアレンジは聞いていて飽きない。（Black）
As/Hi Soundworks,あすはいさうんどわーくす,http://ashisoundworks.blog129.fc2.com/,ロック、ポップス、ピアノ,女,Rapid Ensemble Revival,原曲重視,As/Hiの姉妹サークル。正統派ヴォーカルからピアノソロまで幅広く。(イール)
Ash,あっしゅ,http://21.pro.tok2.com/~ashsound/index.html,ロック、ハウス,,無料頒布CD,,
Ash Blind,あっしゅぶらいんど,,ピアノ,,ピアノのための東方小品集Op.1-1,原曲重視,素直なピアノソロアレンジ。（Black）
AsparTate,あすぱーていと,http://blog.sina.com.cn/aspartate,トランス、ハウス、ピアノ、エレクトロ,女,CombinationREACTION,原曲維持,多彩なアレンジで非常に聴き応えのあるアレンジ。(UR)
Assault Door,あさるとどあ,http://assaultdoor.web.fc2.com/,ピアノ,,CIRNO IN WONDERLAND,原曲重視,非常に安定したピアノ生演奏は必聴です。（和泉）
AT project,あっとぷろじぇくと,http://at-p.info/,ポップス,男女,ムゲンノ音 infinity note,原曲維持,
Atelier　Oguu,あとりえおぎゅう,http://oguu.exblog.jp/,シンセ,,幽々閑々,原曲重視,よろずジャンル原曲重視の安定度は十分。（Black）
Atlas works,あとらすわーくす,http://eos.suppa.jp/,,,Alternative Dark Frenzy,,
Ato-siva,あとしば,http://eos.suppa.jp/koromu/,ハードロック、メタル,,Asteroid remnant,原曲重視～維持,エレギによる原曲メロが哀愁を醸し出すハードロック系インスト。（Black）
Attrielectrock,あとりえれくとろっく,http://triangler.net/,エレクトロニカ,,A Café Chic Records,原曲維持,安定した技術による穏やかなエレクトロニカはBGMにお勧め。（Black）
A-TTTempo,あてんぽ,http://projectshion.xxxxxxxx.jp/,シンセ、テクノ、クラシック,,東方人形大戦,原曲重視,原曲メロに忠実な打ち込みアレンジ。（Black）
AudioINN,おーでぃおいん,http://audioinn.web.fc2.com/,エレクトロニカ、フュージョン,,Touhou Elektronika Works 0.4+,原曲維持～破壊,ゆったりエレクトロニカ、フュージョン系が心地よい。（Black）
AUK,えーゆーけー,http://auk.karakasa.com/,ポップス、ロック、トランス,女,TRIANGLE SENSATION,原曲維持,ダンサブルでハードめなマルチジャンルアレンジに女声ボーカル。（Black）
Azure Line,あずーるらいん,http://circleazureline.sitemix.jp/blog/,テクノ、エレクトロ、トランス、ハードコア,,東方舞日情,原曲維持,スピード感のあるアレンジ。聞いていて楽しくなる。(UR)
Azure&Sands,あずーるあんどさんず,http://bunbun-aya.ath.cx/~tainokobone/,ジャズ、ポップス,女,東方JAZZ,原曲維持～破壊,ジャズアレンジといえばここ。技術は大安定。（Black）
B.L.Addictive,びーえるあでぃくてぃぶ,http://bladdictive.blog28.fc2.com/,ロック,男,LUNATIC BLUSE EP,原曲維持,エレギ分厚めのロックアレンジに男声ボーカル。（Black）
bamboo project,ばんぶーぷろじぇくと,http://page.freett.com/bcd___/th.html,,,放蕩恋娘,,
Bamboo River,ばんぶーりばー,,ダンス,女,東方狂月華,原曲維持,シンプルな四つ打ちにボーカル。（Black）
Barrage Am Ring ,ばらーじゅ・あん・りんぐ,http://barrage.am/ring/,メタル,男女,Barrage Am Ring 0　,原曲維持～破壊,いろんなHR/HMサークルが集まってヘヴィメタルを存分に思い切り奏でるアルバム。（Black）
Be Used,びーゆずど,,シンセ,,Be Addicted ～ 東方廻帰,原曲維持,ダークな雰囲気の打ち込みは魅力。（Black）
Beat-joker,びーとじょーかー,,ダンス、トランス,,MID-NITE EMOTiONS Plus+,原曲破壊,速めのクラブ系打ち込み。（Black）
Belch of Cattle,べるてぇおぶきゃっとる,http://tohocow.tyonmage.com/simpleVC_20100614230355.html,アコースティック,男,TOHO Belch Vol.1,原曲維持,
BeζUMa The さうんど(てくてくあるく。),びーくまざさうんど,http://karitu.web.fc2.com/,民族,,東方演舞奏,原曲重視,珍しい和太鼓(風)と横笛による構成。(りーす)
BITPLANE,びっとぷらん,http://bitplane.info/,民族、オーケストラ、ダンス、テクノ,,EASTERN FAIRY TALE,原曲破壊,不気味な方向へ凝りに凝った構成とコンセプトの確実さ、技術、音重ねどれも珠玉。（Black）
Bitter Quartz,びたーくぉーつ,http://www.tsf-drops.com/,テクノ、ハードコア、ボーカロイド,,MENTALISTS,原曲維持～破壊,四つ打ち系ハードコア分多め。（Black）
Bitter Quartz Vs mono music,びたーくぉーつぶいえすものみゅーじっく,http://www.tsf-drops.com/,トランス、ハードコア,,Pathetic Girls,原曲維持～破壊,哀愁漂うハードめな四つ打ちでごり押し系。（和泉）
BLANKFIELD,ぶらんくふぃーるど,http://blankfield.but.jp/,メタル,,The Edge Of The Knife,原曲維持～破壊,超高速ギターとドラムのかっ飛びっぷり。（Black）
Bliss Rings,ぶりすりんぐす,http://blissrings.blog76.fc2.com/,ハードロック,,Scarlet Rings,原曲維持,ストレートなハードロックインスト。エレギの刻みが印象的。（Black）
Bloody Alice,ぶらっでぃありす,http://bloody-alice.com/,,,空中楼閣奇譚 ～新月～,,
Bloody Sword ,ぶらっでぃそーど,http://bloodysword.dojin.com/,メタル、ハードロック,男,東方歌劇曲,原曲破壊,ヴィジュアル系からメタルまでかっこいい。（Black）
BLUE TRAIN,ぶるーとれいん,http://www.geocities.jp/bluetrain_metal/,,,はなまるグラインド幼稚園,,
BlueMica,ぶるーまいか,http://www.blue-mica.com/,テクノ、エレクトロ,,魔理沙の冒険OST,原曲重視,原曲重視、音を変えてのシンプルな打ち込み。（Black）
BOXELL,ぼっくせる,http://boxell.jp/,ロック、ジャズ、テクノ、エレクトロ、オーケストラ、エレクトロニカ,女,恋々幻想郷オリジナルサウンドトラック,,たくさんのアレンジャーが集いバラエティに溢れるジャンルを一挙出しのサントラ。（Black）
BPM:Maximum Creations,びーぴーえむまきしまむくりえいしょんず,http://bm-creations.com/,オーケストラ、ロック,,永夜抄 ～ Ocestra & Live ～,原曲重視～維持,オケとロックとアレンジ違いの作品。（Black）
Breeze Sinfonia,ぶりーずしんふぉにあ,http://breezesinfonia.momijioroshi.com/,オーケストラ,,天狗ノ活動記録詩,原曲重視,打ち込みオーケストラの音色はきっちりクリアに心地よい。（和泉）
Breeze Sinfonia,,,,,桜天仰ぎ、春見つめ,,壮大なコンセプトが垣間見えるオケインストアレンジ。（Black）
BubbleRecords,ばぶるれこーず,http://bubblerecords-web.com/,ダンス、トランス、ハードコア,,fiori,原曲重視～維持,直球ど真ん中クラブ系。（Black）
BUGSEN,ばぐせん,http://bugsen.freeiz.com/,,,0,,
Business Windows,びじねすういんどうず,http://businesswindows.iza-yoi.net/,エレクトロニカ,,桜梅桃李 - ou bai tou ri -,原曲維持,ゆったりとしたBGM系アレンジ。（Black）
C.H.S,しーえいちえす,http://c-h-s.me/,ハードコア、テクノ、トランス,女,Unlimited Spark!,原曲破壊,ビートは比較的軽めにテクニカルな旋律がばっちりはまる。（Black）
C.S.C→luv,しーえすしーらぶ,http://www.sound.jp/csc-luv/,テクノ、ドラムンベース,,東方NEW WAVE,原曲維持,多彩なテクノアレンジは手堅くBGMにお勧め。（Black）
℃@non,かのん,http://zyuusyakanon.blog53.fc2.com/,ピアノ,,℃on sentimento,原曲重視,生演奏ピアノでシンプルに。（Black）
C9,しーないん,http://www.geocities.jp/c9_cirwo/,テクノ、トランス、ハウス、エレクトロ,女,博麗踊跳曲蒐,原曲維持～破壊,シンプルなクラブ系テイストあふれる「ノれる」アレンジ。（Black）
Cadd⑨th,しーあどないんす,http://cadd9th.blog102.fc2.com/,ロック,男,ファイブ オブ アカインド,原曲維持,粗削りもシンプルな作りのロックボーカルアレンジ。（Black）
Camphor,かんふる,http://camphor0000.blog11.fc2.com/,ダンス、トランス,,remix to TOHO Project soundtrack works,原曲破壊,透明感あるトランス。（Black）
Capricious egoist,かぷりしおうすえごといすと,http://26310.flashhp.net/,ロック,男,終始色　－モノクロ－,原曲維持,聞きやすい男性ボーカル。耳にすんなりと入ってきて聞き心地がよい。(浅葱)
Carbonic Acid,かーぼにっくあしっど,http://tansanca.futene.net/,ロック,男,Melody of Calamity,原曲維持,それほど激しくないロックのメロに乗って伸び伸びと歌う男声ボーカル。（和泉）
CarrotWine.(趣味工房にんじんわいん),きゃろっとわいん(しゅみこうぼうにんじんわいん),http://carrotwine.muse.bindsite.jp/,オーケストラ、エレクトロ、,女,桜　―SAKURA―　紅響楼閣,原曲維持,クラシック、オーケストラアレンジの技術は抜群。（Black）
Casket,きゃすけっと,http://www.yukinohana.net/~casket/,民族、エレクトロニカ,,幻想パブ:午後6時,原曲維持,アイリッシュ風民族アレンジが軽やか。（Black）
Cat Styles,きゃっとすたいるす,,テクノ、エレクトロ、ドラムンベース,女,RosenGarten,原曲維持,テクノ・エレクトロ系の打ち込みに硬めの女性ボーカル。（Black）
CC*=Style ,しーつーすたいる,http://c2-style.net/,トランス,,Crimson Reflection,原曲維持,ユーフォリック系の透き通るトランスが印象的。（Black）
C-CLAYS,しーくれいす,http://www.c-clays.com/,ダンス、ポップス、ロック,女,東方雪花,原曲維持,そこそこ安定した女性ボーカルに高い技術で多彩なアレンジは手堅い。（Black）
Chaos Concerto,かおすこんさーと,,テクノ、ロック、エレクトロ,男女,幻想妖音蒐,原曲維持～破壊,3サークル合同のマルチジャンル。全体的に疾走感。（Black）
Chaos Core Recordings,かおすこあれこーでぃんぐす,http://chaos-core.com/,ロック、クラシック、テクノ,,東方精神裁判,原曲維持～破壊,重厚なアレンジで固めたマルチジャンル。（Black）
CHAOS　MIXER,かおすみきさー,http://chaosmix.net/,,,TOHO CHAOS MIX2,,
ChaoticNoisySound,かおてぃっくのいじぃさうんど,http://s-cns.net/,テクノ、トランス、ハードコア,,FanaticalTohoRave,原曲重視,標準的なトランス。(麦)
charge of uniform,ちゃーじおぶゆにふぉーむ,,,,Red Herring -Practice mode-,,
CHEER☆FACTORY,ちあーふぁくとりー,,,,Gorgeous avenger,,
Cherry　Lunaburst,ちぇりーるなぶらすと,http://cherryluna.exblog.jp/,クラシック,,東方アッチェレランド,原曲重視,クラシックの楽器で生演奏の熱意に敬意。（Black）
Cherry Sound,ちぇりーさうんど,http://sound.jp/cherrysound/,テクノ、クラシック,,Beginning,原曲維持,1曲だけだがシンプルに駆け抜ける。（Black）
CHESS,ちぇす,,ハードロック,,翠,原曲維持,
chipion,ちっぷいおん,,エレクトロポップ,男女,ELECTRiC Re:ViEW,原曲維持,エレクトロポップが華やかに。（Black）
ChongYoke,ちょんよーく,http://chongyoke.web.fc2.com/,ロック、チップチューン、エレクトロ,女,Xanadu,原曲維持,穏やかなロックアレンジに女声ボーカル。電子打ち込み系インストも。（Black）
