へちょ屋,へちょや,http://sanakan.net/hechoya/,ピアノ,,Red eyes,,
ベックマンの廃屋 ,べっくまんのはいおく ,http://music.geocities.jp/balsa_perdida/haioku/,民族,,ベックマンのケーナ～東方編 vol 1～,原曲重視,ケーナでさわやかに東方の世界を表現。（Black）
ヘルガと愉快な仲間たち,へるがとゆかいななかまたち,,,,アイマイモコウ,,
べるべるわーくす,べるべるわーくす,http://bbw.sakura.ne.jp/,テクノ、トランス,,The blossom wind…,原曲維持,きれいめのトランス風インスト。優雅。（Black）
ヘ蝶々,へちょうちょう,http://www.f-butterfly.sakura.ne.jp/,エレクトロ、ハウス,,スペクタクル・ゴシップ,原曲維持,ゆったり成分と哀愁多めのアレンジ。（Black）
ほしのけんきゅうじょ☆(Starsand Sounds Laboratory),ほしのけんきゅうじょ(すたーさんどさうんずらぼらとりー),http://blogofstarsand.blog42.fc2.com/,エレクトロ、トランス,,星之幻想楽曲集2～まともにアレンジやりなさいよっ！！～,原曲維持,
ポチとてぬぐひ,ぽちとてぬぐひ,http://pochigui.net/,ダンス、トランス,,ポチ喰ひシリーズ,原曲維持～破壊,
ぽっくるー3,ぽっくるーすりー,http://takatsukokone.wordpress.com/,,,ハートフルゲンソウキョウ,,
ほねとかわとがはなれるおと,ほねとかわとがはなれるおと,http://boneandskin.blog122.fc2.com/,ロック、エレクトロ,,東方双奏録,原曲維持,手堅い技術が窺えるゆったりめのマルチジャンルアレンジ。（Black）
ほりっくさーびす,ほりっくさーびす,http://holicservice.com/,トランス、,女,エネルギー冷麺お受験せんそ→☆,原曲維持～破壊,
まぃん☆しぃかぁ,まぃん☆しぃかぁ,http://mineseeker.net/,ロック、チップチューン,女,Remember of Mine,原曲維持,
まかろに☆けちゃっぷ,まかろに☆けちゃっぷ,http://macaketchup.web.fc2.com/makaronikechappu/Top.html,オーケストラ、リコーダー,,色なき風,原曲維持,
まぐなむ お～ぱす,まぐなむ お～ぱす,http://homepage1.nifty.com/TAKA-S/,メタル,,東方幻朧悠月抄 ～ Imperishable sin and millennium history ～,原曲維持,重低音の響き溢れるメタルアレンジ。(浅葱)
まぐにちゅ～ど えちゅ～ど,まぐにちゅ～ど えちゅ～ど,http://etyudon.web.fc2.com/,,,東方Etude,,
まさかど☆くらいしすっ！ ,まさかど☆くらいしすっ！ ,http://m-crisis.net/,メタル、トランス、テクノ、エレクトロ、クラシック,,不死鳥☆くらいしすっ！,原曲維持,多数のアレンジャーが集まった手堅いマルチジャンル。（和泉）
まじかるみゅ～ず ,まじかるみゅ～ず ,http://dragontree.sakura.ne.jp/,ポップス、ロック、ハードロック、トランス、エレクトロ,女,幻想急行星蓮線,原曲維持,多彩なマルチジャンルアレンジで軽めに進行。（Black）
マジニ研究所,まじにけんきゅうじょ,http://mazinikenkyuzyo.blog79.fc2.com/,ロック,男,マジニ音楽会,原曲維持,ギターと男声ボーカルのシンプルさがじんわり。（和泉）
マシマロメルトダウン,ましまろめるとだうん,http://mashi-mel.com//,ポップス、エレクトロ,女,HI! HONEY!,原曲維持,軽やかな女声ボーカルとポップサウンド。（Black）
ましろ。,ましろ。,http://www.maromaro.org/,エレクトロ、ロック、ハードコア,,fait accompli,原曲維持～破壊,ロックありトランスありのマルチジャンル、最近は高速極太ハードコアでごりごり。（Black）
マスカルポーネ,ますかるぽーね,http://mascarpone.penne.jp/,ロック、バンド,男,Number Nine,原曲維持,スタンダードなエレキギターによるロックアレンジに男声ボーカルががんばる。（Black）
マタタビ堂,またたびどう,http://yaplog.jp/nekokoneko0802/,,,お嬢様　の誘惑,,
マッカチン企画,まっかちんきかく,http://ameblo.jp/makkahchin/,ロック,男女,幻想ライフポートレート,原曲維持,軽快なロックアレンジに男女ボーカルを乗せて走る。（Black）
まらしぃ,まらしぃ,http://marasy8.com/,ピアノ,,幻想遊戯2 ～Museum of marasy,原曲維持,ニコニコで人気のピアノ生演奏。（和泉）
マンダラ小匣,まんだらこばこ,http://ameblo.jp/musicbox-of-afterglow/,,,東方恋夜月,原曲維持,緩急の付け方が個人的な好み。あまり五月蠅くは感じないが、かといって楽しくない訳じゃない。(九)
ま子とおにい,まことおにい,http://rainxbell.web.fc2.com/,,,切 夜 -setu night-,,
ミーハーナルオト,みーはーなるおと,http://mehernaruoto.net/,オーケストラ,女,ORIN SaGa-Tril of Billion-,原曲維持,
みかん箱,みかんばこ,http://mandarin.dojin.com/mikanbox/,オーケストラ、テクノ、,,electricky,原曲維持,
みずあめ屋,みずあめや,http://mizuameya1.web.fc2.com/,トランス、テクノ、エレクトロ,,Bluesphere,原曲維持～破壊,ハードかつシンプルなテクノ、トランスが特徴。スタンダードな四つ打ちのほか荘厳なクラシック風アレンジも。（Black）
みっちぇる,みっちぇる,,テクノ、エレクトロ,,幻創草子,原曲重視～維持,アップテンポメインのエレクトロ。（Black）
みりんこ☆ふぁんたじあ,みりんこ☆ふぁんたじあ,,,,Mrinko FANTASIA ニコニコとかその1,,
ムラサキノオト,むらさきのおと,http://ameblo.jp/purplesounds/,,,秋神たちの午後　～ Autumn Day's Afternoon,,ドラマCD
めがねこ☆くりにっく,めがねこ☆くりにっく,http://meganekoclinic.web.fc2.com/,,,-上等-,,
メガピコ,めがぴこ,http://riki.pupu.jp/,電波ソング、テクノ、エレクトロ,,東方デラべっぴん,原曲維持,
めておすたじお,めておすたじお,http://meteorstudio.blog24.fc2.com/,,,,,
メトロポリタン39,めとろぽりたんさんじゅうきゅう,http://nitoribass.blog.shinobi.jp/,ロック,女,蛙に睨まれた少女,原曲維持,激しいロックアレンジに気合の入った女声ボーカル。（Black）
もちもちカルテット,もちもちかるてっと,http://motimotiquartett.web.fc2.com/,,,MochiMochiBox vol.4,,
もっふもっふ亭,もっふもっふてい,http://blogs.yahoo.co.jp/dane31415926,,,Undefined Fox Object,,
モノクロ殺人現場写真,ものくろさつじんげんばじゃしん,http://monokurosatsujin.seesaa.net/,ロック,男,Dance Dance Reverie e.p.,原曲重視,
もぱた。,もぱた,http://mopata.iza-yoi.net/,ドラムンベース,女,0,原曲維持,ドラムンベースアレンジに細めの女声ボーカル。（Black）
モヒカンサンドバッグ,もひかんさんどばっぐ,,テクノ、トランス、ゴア・サイケデリック,,Vibration of Womb,原曲維持～破壊,原曲が仄かに香るサイケなアレンジは、聞けば聞くほど深みが増す変り種サウンドです！（瑞葉）
もﾞもﾞ屋 ,もﾞもﾞや,http://mvomvoya.blog.fc2.com/,,,Quixotic Electronica of Duality (Q.E.D),,
もるが～な ,もるが～な ,http://morgana69.web.fc2.com/,ロック,女,闇鍋幻想郷,原曲維持,スタンダードなエレキギター中心のメロの女声ボーカルアレンジ。（Black）
やぁい！,やぁい！,http://aoiro.yu-nagi.com/yaai/index.html,トランス、ロック、テクノ、エレクトロ,,夢現境界-ムゲンキョウカイ-,原曲維持,四つ打ちありロックあり、小技も利かせたスタンダードアレンジ。（Black）
やさしい、酒乱なう。,やさしい、しゅらんなう。,http://syuran007.blog65.fc2.com/,オーケストラ、エレクトロ,,風夜夢、地蓮郷,原曲維持,大胆な変拍子を多用した混濁オケ風インストアレンジ。（Black）
ゆ～ぐれプロジェクト,ゆ～ぐれぷろじぇくと,http://ygr48.web.fc2.com/about.html,ロック、トランス、ポップス,男女,ゆ～ぐれ音楽室,原曲重視,スローテンポなヴォーカルが多め。(イール)
ユウノウミ ,ゆうのうみ ,http://younoumi.com/,メタル、ポップス,男女,東方ラブストリーム,原曲維持,
ゆづき亭,ゆづきてい,http://kimikiss.blogspot.com/,トランス、ユーロビート、テクノ,,YDK's BEST 8850 promotional,原曲維持,
ゆめいろ企画,ゆめいろきかく,,ダンス、テクノ、エレクトロ、ロック、ピアノ,女,Blue Vault of Heaven,原曲重視～維持,多数のアレンジャーが集結したマルチジャンル。（和泉）
よいむつ,よいむつ,http://yoimutu.web.fc2.com/,エレクトロ、アンビエント、ジャズ,,春宵一酔,原曲維持,
りあるご~る堂,りあるご～るどう,http://www.rgdou.com/,テクノ、エレクトロ、チップチューン,,Long night sounds night.,原曲維持～破壊,音の少ない静かなしんみりアレンジ。（和泉）
りすたる,りすたる,http://plaza.rakuten.co.jp/risutaru/,オルゴール,,,原曲重視,
りすとら,りすとら,http://liz-tora.com/liz-tora/,ロック、ジャズ、テクノ、エレクトロ,女,神風,原曲維持,マルチジャンルの幅広いアレンジに安定した女声ボーカルは聴きやすい。（Black）
リベラメンテ・ギタードーナツ,リベラメンテギタードーナツ,http://lmgd.web.fc2.com/,,,,,
りみったる。,りみったる。,http://dhotaru.sakura.ne.jp/event8/,ロック、トランス、ピアノ、メタル,,魔界のプリンセス。/天界のプリンセス。,原曲維持,天子・アリス合同付属のサークル「でんしほたる」再録CD。(UR)
リリーホワイト＆ブラック合同CD企画,りりーほわいとあんどぶらっくごうどうしーでぃーきかく,,トランス、ピアノ、テクノ,,Lily white & Black combination CD,原曲維持,
ルナティックNo.⑨,るなてぃっくなんばーないん,http://luna9.web.fc2.com/,,,,,
るなてぃっくばいぶる(MOMOEM),るなてぃっくばいぶる,http://profile.ameba.jp/t-tama1569/,,,唸れ！桃の極意！桃方憐櫻夢！,,
ロクプラス ,ろくぷらす ,http://rochplus.web.fc2.com/,ロック、トランス、オルゴール,,初雪Style,原曲維持,
ロリコンの地位向上,ろりこんのちいこうじょう,http://remiliahxahxa.iza-yoi.net/,メタル,,Rising from the underground and below,原曲維持,
音空フロール(もえ＠みくる),あおぞらふろーる,http://moemikuru.web.fc2.com/,ボーカロイド、民族,,初音神姫録,原曲維持,
青波ゆらゆら,あおなみゆらゆら,http://aonamiyurayura.web.fc2.com/,ロック、バンドアレンジ,男,有限彩色,原曲維持,エレギメインのバンドアレンジに淡々と男声ボーカル。（Black）
青葉製作所 (幻奏、神像彫刻家),あおばせいさくしょ,,ピアノ、ロック、テクノ、エレクトロ,女,緋色の舞 ,原曲重視～維持,
赤黄色向日葵(碧の向日葵、緋の鈴蘭。),あかきいろひまわり,http://halnem.tobiiro.jp/,テクノ、エレクトロ、ボーカロイド,,POISONOUS PARADE,原曲重視～維持,
茜提灯,あかねちょうちん,http://akanetyoutin.blog54.fc2.com/,,,act1,原曲維持,
紅鋼Project,あかめたるぷろじぇくと,,ロック、メタル,,紅鋼,原曲維持～破壊,メタルアレンジ合同企画。(イール)
秋の空,あきのそら,http://anraku.nothing.sh/akisora/,ダンス、ポップス、エレクトロ,女,星影の天の原,原曲維持,透明感ある女声ボーカルが織りなすマルチジャンル。（Black）
亜紅紫,あくじ,,テクノ、エレクトロ,,SPIRAL NODE,原曲重視～維持,軽やかなエレクトロ。（Black）
鮮夏Derayn,あざかでぃれいん,http://azaca-derayn.sakura.ne.jp/,ハードロック,男,Continue？,原曲維持,ハードかつ暗めのロックに男声ボーカル。声に情熱あふれる。（Black）
朝焼けにて群青(疾走座),あさやけにてぐんじょう,http://asayake.xxxxxxxx.jp/,,,Straying Shootingstar e.p.,,
味玉定食,あじたまていしょく,http://ajitamateisyoku.web.fc2.com/,バンドアレンジ,男,AZITAMASPARK!!,原曲維持,
味ノ素密売所 ,あじのもとみつばいじょ,http://azimitsubaijo.web.fc2.com/,,,エデンの蝶 e.p.,,
明日夢,あすむ,http://asumuayumu.blog95.fc2.com/,ロック,男,Scarlet Syndrome E.P.,原曲維持～破壊,熱いシャウトが面白い。(麦)
雪工房,あとりえすのー,http://atelier-snow.sakura.ne.jp/,ピアノ、ロック,男,R e d & B l u e,原曲重視,
暴LADY,あばれでぃ,http://dpckempyrean.blog.shinobi.jp/,バンド,男,幻想郷anthem,原曲維持～破壊,力強いボーカルアレンジ。曲とボーカルがマッチしている。(九)
天風やまがた ,あまかぜやまがた,,,,東方ドーナツ,,
雨具文庫,あまぐぶんこ,http://amagubunko.web.fc2.com/,,,Arcano casino,,
安眠(あみん)ガレキのばぁー,あみんがれきのばぁー,http://amingb.web.fc2.com/,シンセ、ボーカロイド,,電騒幻聴響,原曲重視,
妖幻楽団,あやかしげんがくだん,,クラシック、テクノ、エレクトロ,,妖幻楽集 お試し盤+α,原曲維持,
荒御霊,あらみたま,http://arami.rdy.jp/,テクノ、ハードコア、ブレイクビーツ、トランス、アンビエント,,SpellCoreシリーズ,原曲維持～破壊,定評ある極太ハードコアメイン、アンビエントもこなす打ち込み系アレンジ。（Black）
歩いて行きまっしょい!!,あるいていきまっしょい,http://aruite1024.web.fc2.com/,アコースティック、エレクトロニカ,,touhou Brass style,原曲維持,
命の限り好き勝手。,いのちのかぎりすきかって,http://ameblo.jp/leavatein/,,,止まらない風,,
弥栄(いやさかえ),いやさかえ,http://iyasaye.web.fc2.com/,エレクトロ,,9step.,原曲維持～破壊,独特な変拍子アレンジ。(イール)
俺++(Includeore),いんくるーどれ,http://includeore.com/,民族、ポップス,女,慣 -TRADITION-,原曲維持,スマートな民族風ポップスアレンジ。（和泉）
初陣音屋,ういじんおとや,http://otoya.uijin.com/,ロック、ポップス、トランス、ハードコア、テクノ、エレクトロ、クラシック、エレクトロニカ,男女,紅白初陣音合戦！,原曲維持,ほぼ初アレンジのアレンジャーたちを一堂に集めたマルチジャンル企画。（Black）
植木屋,うえきや,http://uekiya.daa.jp/,テクノ、エレクトロ、ダンス、ロック,女,幻想蓄音館,原曲維持～破壊,東方幻想連鎖OST。（Black）
鶯壱里,うぐいすいちり,http://yumedokei.com/,ピアノ、テクノ、エレクトロ,,Inf Magicシリーズ,原曲維持,高速ピアノアレンジが気持ちいい。（Black）
空分,うつほわかち,http://utuhowakati.blog117.fc2.com/,,,DETERMINATION,,
宇部ソフトウェア技術研究所,うべそふとうぇあぎじゅつけんきゅうしょ,http://ustlab.fmp.jp/,チップチューン,,周波数変調奇譚,原曲重視,原曲を重視したチップチューン。安心して聞ける。(獏)
縁側話製作委員会,えんがわばなしせいさくいいんかい,http://tohodrama.syuriken.jp/,ドラマCD,,ドラマCD,原曲維持,ドラマCDの合間合間に挟まれるシンプルな軽めのアレンジ。（Black）
扇乃茶屋,おうぎのちゃや,http://d.hatena.ne.jp/amsteria/,バンドアレンジ、エレクトロニカ,,ビッグバンド綺想曲,原曲維持,素直なバンド風味と穏やかなエレクトロニカインストアレンジ。（和泉）
大江戸宅急便,おおえどたっきゅうびん,http://www.ooedo.jp/,テクノ、エレクトロ、トランス,,月刊ミゾノクチシリーズ,原曲維持,初期から続く老舗サークル。安定したアレンジ。(イール)
堕武者グラインド ,おちむしゃぐらいんど ,http://vomitinkesennuma.blog51.fc2.com/,グラインドコア,男,東方マカダミア１０４～Stab me if you can.,原曲維持～破壊,突っ走るドラムと唸るベースと切れるデスボイス。（Black）
音乃葉解体御調処,おとのはかいたいおんちょうどころ,http://www.cheebow.me/,,,東方エアロ,原曲維持,
音召缶 ,おとめかん,http://otome-kan.net/,トランス,女,東方音対無シリーズ,原曲維持,
俺は十進法を採用しました。,おれはじゅっしんほうをさいようしました,http://gmsyoutenha.blog51.fc2.com/,テクノ、エレクトロ、ハウス、クラシック,,東方合成雅懐,原曲維持,テンポ速めのピアノや激しいエレクトロなどバラエティに富んだインストもの。（Black）
音不知,おんしらず,http://onshiraz.blog112.fc2.com/,ジャズ、スカ,,音返し～vol.1～,原曲維持,
懐風堂 東町支店,かいふうどうひがしまちしてん,,ロック,男,永々しき星の夜,原曲維持,ストリングスとピアノの音色が単純ながらも気持ちいいロックアレンジに頑張る男声ボーカル。（和泉）
快楽音楽堂,かいらくおんがくどう,http://17.pro.tok2.com/~nijiden2/kaion/,ハードロック,男女,東方乱奏盤,原曲維持～破壊,シンプルな快速ハードロックに低中音をがんばった女声ボーカルとデスボイス男声ボーカル。（Black）
回覧百貨箱 音楽工房,かいらんひゃっかばこおんがくこうぼう,http://tw.kairan.info/,オーケストラ,,森林休暇 + 東方アレンジ,原曲重視,
回路 -kairo-,かいろ,http://www.k-a-i-r-o.com/,ロック、メタル,男女,3/4　～ three times of the east ～,原曲維持,抽象的なセカイ系味わいの雰囲気がするロックボーカル。（Black）
九龍海鮮飯店,かおるーんかいせんはんてん,http://www.team-nekokan.com/tetuxneko/kaisenhanten/,ロック、ポップス,男女,桜華,原曲重視～維持,ニコ動で人気のてつ×ねこのメンバーによる東方アレンジ。少し癖のある硬めの男声ボーカルに手堅いロックアレンジ。女声ボーカルバージョンもある。（Black）
楽団ロマンティシズム,がくだんろまんてぃしずむ,http://gakuroma.blog118.fc2.com/,,,東方　サリスティーナ☆,,
格納庫,かくのうこ,http://subhangar.web.fc2.com/,ハードコア、トランス,,HappyHappyLunatic,原曲維持,メロ重視のトランス、軽めハードコア系インストアレンジ。（Black）
神楽庭園,かぐらていえん,http://kagura.secret.jp/,テクノ、トランス、ロック,,紅夜事変 -神奏楽曲集II-,原曲維持,高速かっ飛びありじんわり聴かせありのテクノ系打ち込みインストアレンジ。（Black）
華絹花,かけんばな,,ワルツ、ダンス、和風,,春夏秋トウホウシリーズ,原曲維持,三拍子をメインに様々なジャンルの曲をアレンジ。明るい曲が多く、どの曲も安定感がある。(隆)
梶迫小道具店,かじばこどうぐてん,http://cajiva.net/,テクノ、エレクトロ、エレクトロニカ、ドラムンベース,,Hide & Seek,原曲維持～破壊,バラエティに富む打ち込みに色付けのボーカルまで入ってシンプルながらも飽きさせない。（Black）
華胥の永眠,かしょのえいみん,,,,xxxの神隠し,,
加水分解,かすいぶんかい,http://ran.miraru.com/midi/midi.htm,,,無料頒布CD,,
春日町,かすがちょう,http://www.kasugachoo.com/,オーケストラ,,東方SRPG乱愚風サウンドトラック,原曲維持,朗々としたスタンダードなオケアレンジ。（Black）
和弘法,かずこうぼう,http://www.kazukoubou.net/,クラシック、ハーモニカ,,東方１人○役シリーズ,原曲重視～維持,ハーモニカアレンジは珍しい。（Black）
華霞魅-kasumi-,かすみ,http://kasumiweb.web.fc2.com/,メタル,,霞色シリーズ,原曲維持,
株式会社虎の穴,かぶしきがいしゃとらのあな,http://www.toranoana.co.jp/,テクノ、エレクトロ、ロック,,東方詞華集シリーズ,原曲維持,大安定のアレンジャーたちを集めたマルチジャンル。（Black）
神乃木製作所,かみのぎせいさくしょ,http://ss.kaminogi.net/,テクノ、エレクトロ,,東方神楽祭シリーズ,原曲維持,しみじみとミドルテンポのマルチジャンル。（Black）
花梨糖達の宴,かりんようたちのうたげ,,,,花梨糖達の気紛れ祭,,
渦錬,かれん,http://homepage2.nifty.com/ravina/karen/,ハウス、ポップス,女,静謐なるは少女の中に,原曲維持,シンプルなメロにシンプルながらもかわいらしい女声ボーカル。（Black）
刻刻音樂館,ぎざぎざおんがくかん,http://www42.tok2.com/home/samidaremidi/,エレクトロ、ゲーム,,流流天水音 ~Nagaruru Amenomizuoto~,原曲重視,原曲のメロディや雰囲気を色濃く残した東方Project的世界観に基づいたアレンジ。（Black）
疑似科学出版会,ぎじかがくしゅっぱんかい,http://anthlopos.xxxxxxxx.jp/,,,,,
岸田教団,きしだきょうだん,http://k-kyoudan.s61.xrea.com/,バンドアレンジ,女,SuperSonicSpeedStar,原曲維持,非常に聴き応えがあり、ボーカルとアレンジの組み合わせが絶妙。(獏)
喫茶「過労死」,きっさかろうし,http://members.jcom.home.ne.jp/neomuscat/,,,Farther,,
狐の工作室,きつねのこうさくしつ,http://yuki-factory.main.jp/main/,オーケストラ,,東方幻想界シリーズ,原曲維持,安定したクラシックアレンジ。(イール)
君の美術館,きみのびじゅつかん,http://www.kimino-museum.com/,ロック、ワルツ,男女,dialogueシリーズ,原曲重視,手堅い生演奏サークル。非常に聞きやすく、BGMとして最適。(獏)
求代目の紅茶会 & 科学世紀のカフェテラス記念合同,きゅうだいめのこうちゃかい あんど かがくせいきのかふぇてらすきねんごうどう,http://ninth-gen-teaparty.info/01/hanpubutsu.shtml,テクノ、エレクトロ、トランス、ロック、エレクトロニカ,女, PARALLEL DREAMERS　～ the fantastic memorial fan books,原曲維持～破壊,打ち込み成分多めのマルチジャンル秘封倶楽部オンリーアレンジ。（Black）
永久立体＜キュービックループ＞,きゅーびっくるーぷ,http://i13mistoffeleese.blog45.fc2.com/,テクノ、トランス、ハードコア,,永久立体,原曲維持,バラエティに富むややダークなテクノ系インストアレンジ。（Black）
境界茶店,きょうかいさてん,,,,東方ノッキチ羊羹,,
餃子屋本舗,ぎょうざやほんぽ,http://www.gyozayahonpo.com/,民族,,東方二胡シリーズ,原曲維持,二胡の生演奏は貴重。（Black）
狂奏楽団,きょうそうがくだん,http://kyousou-gakudan.com/,メタル,女,東方夢幻奏　～The dream and phantom with ephemeral tune～,原曲重視,ボーカルはゴシック系。語りが入る辺り好みが分かれるかも？(獏)
玉座研究所(仮),ぎょくざけんきゅうじょかっこかり,http://circlegyokuken.blog11.fc2.com/,メタル、ミニマル、テックハウス,男女,冥界を流れる雲のように,原曲維持～破壊,静かさと激しさ、そのどちらもを綺麗にアレンジしているように思う(UR)
極東アウトブレイク,きょくとうあうとぶれいく,http://echoproject.xxxxxxxx.jp/eob.html,ロック,男女,極東アウトブレイク,原曲維持,スタンダードなロックアレンジに素直なボーカルを乗せて。（和泉）
極東海賊団,きょくとうかいぞくだん,http://kyokutou.xxxxxxxx.jp/,メタル、ハードロック,男,博麗神社焼肉祭～Extreme Grill Fest～,原曲維持～破壊,重低音メタルにシャウトで疾走メタルアレンジ。（和泉）
金蓮亭,きんれいてい,http://goldenlotus.zouri.jp/,ピアノ,,永麗紅夜,原曲維持,シンプルなピアノオンリーアレンジ。（Black）
黒岩君の美術館,くろいわきみのびじゅつかん,http://www.kimino-museum.com/9610/brm2.html,,,Black Rock Museum 2,,
黒兎団,くろうさぎだん,,テクノ、ロック,,上海冷茶館HOT,原曲維持,ひと癖ひねったアレンジが面白いです。（和泉）
黒ヶ音研究室,くろがねけんきゅうしつ,http://kuroganelab.sakura.ne.jp/,ハードロック、メタル,,LIGHTNING MIRAGE,原曲維持,速い速いかっ飛びドラムにエレギ原曲メロがかっこいい。（Black）
群青リボン ,ぐんじょうりぼん,http://gunjouribon.web.fc2.com/,ロック,男女,初染E.P.,原曲維持,爆走系ロック男声ボーカルアレンジにややゆったりめロック女声ボーカルアレンジ。（Black）
群馬東方会,ぐんまとうほうかい,http://gunmatohokai.web.fc2.com/,ポップス,男女,東方アレンジと聞いて１,原曲維持～破壊,ポップス・電波系ヴォーカルアレンジ。(イール)
月面着陸ファージ,げつめんちゃくりくふぁーじ,http://moonphage.net/blog.html,テクノ、トランス、メタル,,幻想狂走譜シリーズ,原曲重視～維持,かっ飛ぶビートのトランスアレンジ。ギターが呻き突っ走るメタル系インストも。（Black）
