FORCE FIELD,ふぉーすふぃーるど,http://forcefield.blog102.fc2.com/,テクノ、チップチューン,,東方真奏曲 壱 ～Theme of Reimu ,原曲重視,原曲メロ重視のゲーム波形系チップチューンアレンジ。（Black）
Foreground Eclipse,ふぉあぐらんどえくりぷす,http://www.fg-eclipse.net/,ロック,女,Foreground Eclipse 1st EP,原曲維持,熱いギターに力強い女声ボーカル。（Black）
Forest306,ふぉれすとさんまるろく,http://forest306.com/,アコギ,,東方阿漕集,原曲重視～維持,アコギのシンプルな響きに癒される。（Black）
Foughten Field Bar,ふぉうとぅんふぃーるどばー,http://mugentou.web.fc2.com/cc14.html,,,かぜのとおりみち,,
FOX RAVEL,ふぉっくすらべる,http://foxravel.ehoh.net/,ダンス、トランス,,Magic Magical Night ,原曲維持,
Foxtail-Grass Studio,ふぉっくすているぐらすすたじお,http://f-g-s.sakura.ne.jp/,ハウス、エレクトロニカ、民族,,pastoral landscape,原曲維持,非常にすんなりと入ってくるゆったりと穏やかなハウス、エレクトロニカ。じんわり。（Black）
fractaleline(Polyphonic Bug Choir),ふらくたるらいん,http://fractaleline.in/,ハウス、テクノ、トランス,,Sound in Scape,原曲維持～破壊,キラキラした音遣いが印象的なゆったりめテクノ、ハウス系インスト。（Black）
FragileOnline,ふらじーるおんらいん,http://www.shinsekai.co.uk/,ロック、ドラムンベース、ポップス,女,Abbey Road,原曲重視～維持,プログレッシブ風のロックならこちら。（Black）
Free Air Sound,ふりーえあーさうんど,http://freeairsound.blog.shinobi.jp/,,女,夢と現の空模様,,
FreeAirSound,ふりーえあーさうんど,http://freeairsound.blog.shinobi.jp/,ポップス、ロック,女,幻想夢物語,原曲維持,ドラマのトラックもあるロックテクノインストやポップスボーカルアレンジ。楽しそう。（Black）
free-logic ,ふりーろじっく,http://freelogic.blog59.fc2.com/,ダンス、トランス,,Third-logic,原曲維持,聴き心地のいいきれいなトランス。（Black）
from～?～,ふろむ？,,ラップ、テクノ、エレクトロ、ロック,男女,V.A./from～?～ Compilation Vol.1,原曲維持～破壊,
fromadistance/spctrm,ふろむあでぃすたんす/すぺくとるむ,http://fromadistance.info/,クラシック、エレクトロ,,eureka,原曲破壊,クラシック基調の大胆かつ荘厳なアレンジ。お勧め。（Black）
Frontier Aja,ふろんてぃあえいじゃ,http://aja-games.com/,ロック、クラシック,女,紅魔城伝説OST,原曲維持～破壊,
FRONTIERCREATE（FrontierRecords）,ふろんてぃあくりえいと,,ダンス、ポップス、ロック,女,frontier,原曲維持,多様なジャンルにボーカルを合わせて。（Black）
Frozen System Records,ふろーずんしすてむこれーず,http://fsr.jpn.org/,ハードコア、ブレイクコア、ロック、ポップス,女,lunar eclipse,原曲維持～破壊,アルバムごとにマルチジャンル。ハードコア系の切れ味。（Black）
Fuel Tiger Records,ふゅーえるたいがーれこーず,http://ameblo.jp/ftrecords/,テクノ、エレクトロ、トランス,,Azure from U.G,原曲維持,激しく厚めのエレクトロメインのインストアレンジ。（Black）
FUNTEK LAB.,ふぁんてっくらぶ,http://ameblo.jp/funtek-mixago/,ファンキーハウス、FUNKOT,,ゲンソウ＠ドゥグム,原曲維持,世にも珍しいFUNKOTオンリーアレンジ。ファンキーにノリがよいダンサブルなアレンジ。（Black）
Further Ahead Of Warp ,ふぁーざーあへっどおぶわーぷ,http://faowcore.web.fc2.com/,ハードロック,,Further Ahead Of Warp 1st Demo,原曲維持,原曲メロを活かした疾走ハードロック。（Black）
Futon,ふとん,http://www.futonweb.net/,ジャズ、フュージョン,,West End Girls,原曲破壊,軽いジャズ風インストはカフェのような雰囲気。（Black）
Garage Lover!,がらーじらばー,http://nissy.happy.nu/,ダンス、テクノ、エレクトロ,,少女幻樂 -Deceptive Cadence-,原曲維持,軽やかに鋭く切り込む電子音。（Black）
GASETSU,がせつ,http://gasetsu.ddo.jp/,テクノ、エレクトロ,,幻境現奏曲～スキマ～,原曲維持,
GATLING CAT,ガトリングキャット,http://gatling-cat.sakura.ne.jp/,ロック、テクノ、エレクトロ,女,東方活劇綺談樂曲選,原曲維持,軽快なロックアレンジが気持ち良い。（Black）
GAくらぶ,がーくらぶ,http://d.hatena.ne.jp/silentleen/,,,My First ⑨！,,
GCF,ごーるでんしてぃーふぁくとりー,http://www.gcfactory.sakura.ne.jp/,テクノ、ドラムンベース、ポップス,女,東方ミッドナイト,原曲維持,全体的にゆったりと整った音が印象的。（Black）
GET IN THE RING,げっといんざりんぐ,http://gchm-music.com/,ポップス、ロック,女,After everlasting,原曲維持,シンプルなポップス、ロックアレンジに柔らかめの女声ボーカル。（Black）
GetTheRabbitOut,げっとざらびっとあうと,http://usakichi-mu.info/,ロック,女,肴音,原曲維持,軽めのロックアレンジに女声ボーカル。（和泉）
Girl's short hair,がーるずしょーとへあー,http://girlsshorthair.iaigiri.com/,ロック,男,幻想夜景,原曲維持,
Go A Round,ごーあらうんど,http://goaround.sakura.ne.jp/,テクノ、エレクトロ,,ARound Blue,原曲維持,シンプルで音の少ないアレンジ。（Black）
Gods A Ghos,ごっずあごーず,http://godsaghos.orz.hm/,ピアノ、テクノ、エレクトロ、ロック,男女,むらこが！☆もーにんぐぼやーじゅ,原曲維持,丁寧に工夫が凝らされたメロが印象的。ボーカルもある。（Black）
Golden Pe Done,ごーるでんぺどーん,http://goldenpedone1.web.fc2.com/,テクノ、エレクトロ,,Make a slit downwards,原曲維持,
GP1,じーぴーわん,http://gp1.in/,ハードロック,,空也色シリーズ,原曲維持～破壊,シンセとギターのバランスがよい端正なハードロック。（Black）
gravity,ぐらびてぃ,http://gravity-crim.blogspot.com/,ハードロック、メタル,,Strong in the Rain,原曲維持,スタンダードなハードロック風。（Black）
GUNFIRE ,がんふぁいあ,http://gunfire.web.fc2.com/,ダンス、トランス,,TOHOBEAT FLASHシリーズ,原曲維持,
gunter10 UNITED Records,ぎゅんたーてん ゆないてっど れこーず,http://gunter10.jimdo.com/,ダンス、トランス,,TRANCE JUNKIE vol.1,原曲維持,華やかなトランスアレンジ。（Black）
GYAS,ぎゃす,http://blog.livedoor.jp/koheidragons/,ロック、ポップス、エレクトロ,男女,恋色幻想,原曲維持,
GyroVox（GyroMix）,じゃいろぼっくす,http://www.xacs.jp/,テクノ、ロック、エレクトロ,,Scape Goat,原曲重視,手堅いアレンジャーたちが集結。おとなしめなアレンジ。（Black）
hajime（仮）,はじめかっこかり,http://seven-moon.main.jp/,ロック、エレクトロ,女,ハジマリ,原曲重視,ゆったりとして聞きやすいヴォーカルアレンジ。(イール)
hajime（仮）(seven moon),はじめかっこかり,http://seven-moon.main.jp/,ポップス,女,ハジマリ,原曲維持,
Hakoten,はこてん,,,,Disreader Wish for bｌack wing Hakoten band 3 way 6 song sprit ep,,
Halozy ,はろじー,http://www.halozy.com/,ダンス、トランス,女,Crescendo Planet,原曲維持～破壊,直球で分かりやすいダンスアレンジに豪華女声ボーカル。（Black）
HAPPY CLOVER,はっぴーくろーばー,http://nekomiko.com/,テクノ、ロック、ポップス,女,Termination Road,原曲維持,暗めに朗々としたマルチジャンルアレンジ。（Black）
HAPPY I SCREAM!!,はっぴーあいすくりーむ,http://ameblo.jp/happy-i-scream/,ロック、エレクトロニカ,女,Helianthus,原曲維持～破壊,エレギの刻みざくざくロックに女声ボーカル。（Black）
Helios Create,へりおすくりえいと,,テクノ、エレクトロ,,東方⑨音譚,原曲維持,
Human Error,ひゅーまんえらー,http://www.humanerror.info/,バンドアレンジ,男,Trial and Error,原曲維持,ギターメインのバンドに男声ボーカルが叫ぶ。（Black）
Icarus' cry,いかろすくらい,http://icarus-cry.syncl.jp/,ハードロック、メタル,男,ADVANCE TO THE DREAM,原曲維持～破壊,かっ飛ぶドラムとエレギに朗々と響く男声ボーカル。（和泉）
iD-Es,あいでぃーいーえす,,ロック,,BRAIN BLEND（デモ）,,
Iemitsu.,いえみつ,http://iemitsu.net/,ハードコア、トランス,女,IA-STYLE/Toho,原曲破壊,図太いビートと激しいシンセに新たな解釈を。（Black）
Imprison Equity,いんぷりずんえくいてぃ,http://ameblo.jp/ou-yo/,ロック、ハードロック,男女,卍-アニュ＼トス■,原曲維持,ゴシック系ロックボーカルアレンジ。哀愁的で確実な演奏に乗せて朗々と歌い上げるボーカル。（Black)
Independent Works,いんでぺんでんとわーくす,http://blog.livedoor.jp/kenichi_tanaka/,テクノ、エレクトロ,,THE THING!,原曲破壊,ミニマルや音の少ないテクノ。（Black）
INFINITY,いんふぃにてぃ,http://infinity-web.syncl.jp/,ハードロック、メタル,男女,東憐乱舞,原曲維持,多彩なギターに女声ボーカル多め。（Black）
ink touch,いんくたっち,http://www.geocities.co.jp/Playtown-Yoyo/9181/ink_touch/,テクノ、エレクトロ,,Sky of Twilight,原曲重視～維持,原曲メロを活かした暗めの打ち込み系。（Black）
Innocent Key,いのせんときー,http://movieplanet.dyndns.org/~Innocent_Key/,ダンス、ポップス,男女,東方サマーバケーション,原曲維持,電波ソングも含めた軽やかなダンスポップ。（Black）
INNOCENT WORKS,いのせんとわーくす,http://www.ab.auone-net.jp/~savan/,ダンス,,ORIENTAL VIBES,,
intworks,いんとわーくす,,テクノ、エレクトロ,,WELCOME TO THE WARPED DISCO,原曲破壊,前衛的なテクノ風。爽快。（Black）
ion,いおん,,ダンス、トランス,,Spiritual Spellers,原曲維持～破壊,シンプルなトランス系。（Black）
IOSYS,いおしす,http://www.iosysos.com/,ダンス、ポップス、ロック,男女,東方乙女囃子,原曲重視～維持,手堅いマルチジャンルアレンジ技術に手堅いボーカル、安定度はピカイチ。（Black）
IRC発突発企画,あいあーるしーはつとっぱつきかく,,テクノ、エレクトロ,,Lama is Dead,原曲維持～破壊,豪華アレンジャーがまじめに遊んだラマアレンジ。（Black）
IRON ATTACK!,あいあんあたっく,http://ameblo.jp/ironchino/,ロック、メタル,女,CRYING DESTINY,原曲維持,王道ギターが唸り駆ける。（Black）
izmizm,いずみずむ,http://izmizm.net/,ダンス、テクノ、エレクトロ,,Revivify,原曲維持,比較的穏やかな展開が聴きやすい。（Black）
J&B,じぇいあんどびー,http://www.m-jb.com/,ロック,女,airhead,原曲維持,
Jamming bit,じゃみんぐびっと,,テクノ,,jamming bit,原曲維持,シンプルなデジタル色が強めのアレンジ。（Black）
jeangsk家,じゃがさかけ,,トランス、ハードコア、テクノ、エレクトロ,,風見効果　～Weathervane Effect,原曲維持～破壊,高速かつ不気味なハードコアトランス系インスト。（和泉）
Jeux interdits,じゅーいんてるでぃっつ,,ロック、ハードコア、エレクトロ,女,Twilight Nightmare,原曲維持～破壊,
JF UNION,じぇいえふゆにおん,http://jf-union.com/,ロック、ポップス、エレクトロ,男女,Liｌac Mist,原曲維持,いろいろなタイプのアレンジに男女ボーカルが乗ったポップ寄り。（Black）
JUDSTYLE,じぇいゆーでぃーすたいる,http://judstyle.jp/,チップチューン,,FM紅魔郷,原曲重視,シンプルなチップチューン。（Black）
JUNCTION PROJECT,じゃんくしょんぷろじぇくと,http://junction-project.sakura.ne.jp/,エレクトロ、ピアノ,女,RED ROSE,原曲重視,
JunKY-jaM,じゃんきーじゃむ,http://jak.mistywhite.net/,テクノ、エレクトロ、ハウス、ジャズ,,幻想遊戯場,原曲維持,ゆったりめのテクノ、アンビエント、ジャズ系。（Black）
K1-Style,けーわんすたいる,http://www.k1-style.net/,ロック,男,SUBTERRANEAN PopISM,原曲維持～破壊,
K2 SOUND,けーつーさうんど,http://www.c-clays.com/,ポップス、ロック、トランス,女,花篝 HANA-KAGARI,原曲維持,マルチジャンルに女声ボーカル。トランスインストアレンジは懐かしい音色。（Black）
k6project,けーろくぷろじぇくと,http://byourou.web.fc2.com/k6project/,テクノ、エレクトロ、トランス、ハードコア、ロック、ハウス,女,"k6project ~Thank you ""Lotus land""",原曲重視～破壊,総勢438名とちょっとの参加、アレンジだけでも46曲という最大級企画のマルチジャンル。（Black）
kanival,かーにばる,http://kanivalkanival.web.fc2.com/,ロック,男,ナイツレイベル,原曲維持,重め低音重視のロックアレンジに男声ボーカル。（Black）
kaon,かおん,,ハードロック,女,東方デスボール,原曲維持,バリバリロックにがんばる女声ボーカル。（Black）
KARASHIC RECORDS,からしっくれこーず,http://karashicrecords.com/,トランス、テクノ、エレクトロ,,Mystic Potential,原曲維持～破壊,四つ打ちメインのやや暗めな進行が雰囲気を出している。（和泉）
Karkan,かるかん,http://www.karkan.net/,ロック、クラシック、民族,,宵星標,原曲維持,
KARMART,かるまーと,http://karmart.sakura.ne.jp/,ロック、テクノ,男,Echos,原曲維持～破壊,他とは一味違う物憂げで暗めのギターが奏でる東方。（Black）
Key Music,きいみゅーじっく,http://www.keymusic.info/,ポップス、テクノ、クラシック,女,東方見聞録シリーズ,原曲重視～維持,シンプルな味付けのマルチジャンル。（Black）
Key stone,きーすとーん,http://blog.livedoor.jp/by_the_window_/,バンド、ロック,,doll's heart,原曲維持,定番ロック。やや粗めだが哀愁漂うシンセの原曲メロ。（Black）
KINZOK ON,きんぞくおん,http://kinzoku.xxxxxxxx.jp/,エレクトロ、テクノ、ハードコア,,Bug core,原曲維持～破壊,ごりごり押しまくるハードコア。（Black）
Kissing the Mirror ,きっしんぐざみらー,http://www.aod666.com/,メタル,,Fatal Synthe's Awaikening,原曲維持,ギターソロによる原曲メロが華々しいメタル。（Black）
Klang-Gear,くらんくぎあ,http://klang-gear.x0.com/index.cgi?target=index,民族、ロック,,東風吹かば,原曲維持,異国情緒溢れる民族アレンジとロックアレンジ。（Black）
Knight cherry blossomS,ないとちぇりーぶろっさむず,,,,鋼鉄メロディアススパーク,,
Knights of Round,ないつおぶらうんど,http://www.radio-mnc.net/KNTS-0002/,ハードロック、トランス、テクノ,,Knights of Roundシリーズ,原曲維持～破壊,多数のアレンジャーによるマルチジャンル。安定感抜群。（Black）
Kota-rocK,こたろっく,http://kota-rock.com/,メタル,男,Birth of Fire,原曲破壊,重厚なメタルアレンジに男声ボーカルがマッチ。（Black）
KPDrecords,けーぴーでぃれこーず,,テクノ、エレクトロ,,The moon of reverberation,原曲維持～破壊,挑戦的な構成やノイズが印象的。（Black）
Kraster,くらすたー,http://kraster.jp/,テクノ、ロック,男女,東方雨月譚,原曲維持,
krossway,くろすうぇい,,トランス、エレクトロ,,手焼き東方アレンジCD,原曲維持,
KSNT,けそなと,http://ksnt.sakura.ne.jp/blog/,エレクトロ,,ココロのノコリガ,原曲重視,原曲メロを維持してノイズなどの味付けをうまく施したアレンジ。（Black）
k-waves LAB,けーうぇーぶすらぼ,http://kou-ogata.net/,民族,,幻想郷ポポルカント,原曲重視,アイリッシュ楽器生演奏でゆったりと。（Black）
L.I.C.,えるあいしー,,ハードコア、トランス,,coure,原曲破壊,
La Sonotasia,ら・そーのたしあ,http://bluefulcrum.web.fc2.com/,民族、ロック,女,Rune Girl in My Mind,原曲重視,哀愁漂う民族風ヴォーカルアレンジ。（鰻）
La Sonotasia,らそーのたしあ,http://bluefulcrum.web.fc2.com/,民族、ロック,女,Rune Girl in My Mind,原曲維持,どこか懐かしさを感じるボーカルアレンジ。ZABADAK風味？（Black）
La*vigne,らヴぃーにゅ,,テクノ、エレクトロ,,東方サンギート,原曲維持～破壊,軽やかにシンプルに、さらりと過ぎていくテクノ。（Black）
Lab C.C.Lemon -CCレモン実験室-,らぶしーしーれもん,http://pocky.real-sound.net/c-c-lab/,ボーカロイド、テクノ、ロック,,Neglectworld,原曲維持,
LABEL ARPEGGIO-Sound,らべるあるぺじおさうんど,http://homepage3.nifty.com/LAS/,オーケストラ,,東奔西走,原曲維持,シンフォニックのメロが朗々と。（Black）
Laid-Back Style,れいどばっくすたいる,http://lbstyle.blog.shinobi.jp/,メタル,,Vampiric rage,原曲維持,重く激しく唸るギターインスト。（Black）
LAL,えるえーえる,http://www.lalnet.info/,ハードロック、エレクトロ、民族,,西方風来シリーズ,原曲維持,
Languid space,らんきっどすぺーす,http://languidspace.seesaa.net/,テクノ、エレクトロ,,FOUR BEATS,原曲維持～破壊,やや暗めに淡々と進む四つ打ち。（Black）
Lapis moss,らぴすもす,http://kobakyon.net/,ハードコア、トランス,女,明鏡神水,原曲維持～破壊,Rolling Contactがハードコア以外の曲も提供、女声ボーカルを乗せて。（Black）
L'ARCHANGE,らるかんじゅ,http://kagutsuchi.jp/(18禁注意),ハードロック,,トウホウノツメアワセ,原曲重視,軽めだが速いハードロック、メタル風。（Black）
Last Sphere,らすとすふぃあ,http://sound.jp/lastsphere/,テクノ、エレクトロ、ロック,女,Eternal-解放-,原曲維持,
laughing out loud,らふぃんぐあうとらうど,http://lollol.client.jp/,トランス,,anxiety,原曲維持,厚いビートの迫力を感じるトランス。（Black）
LAVO,らぼ,http://www.llaavvoo.com/,テクノ、エレクトロ,,SACRED MUSIC FOR THE PLEASANT GODDESS,原曲維持,
LEAP＆LOOP,りーぷあんどるーぷ,,ロック、バンド,男,Over image,原曲重視,
Level0,れべる０,,バンドアレンジ,女,EP-0,原曲維持,バンドっぽいシンプルなアレンジに、女性ボーカルが頑張っている。（Black）
LevoLution（TranceShift）,れヴぉりゅーしょん,http://levolution.info/,トランス、ドラムンベース,,Skyrise,原曲維持,透明感、幻想感が気持ちよいトランスアレンジ最高峰。（Black）
L-Garden,えるがーでん,,テクノ、エレクトロ、トランス、ロック,女,偽幻想曲集,原曲維持,いろいろな風景が浮かんでくるマルチジャンルアレンジ。（Black）
Light?Staff,らいとすたっふ,,ロック,女,K点,原曲重視～維持,同人らしい粗さがかえって魅力かも。（Black）
Like a rabbit,らいくあらびっと,http://likearabbit.info/,ポップス、ダンス,女,Sparking for You!!,原曲維持,ライトなポップスアレンジに女声ボーカルがぴったり。（Black）
LiLA'c Records,りられこーず,http://www.lilac-records.com/,トランス、ダンス、テクノ、エレクトロ,女,LiLA'c Records SAMPLER 01,原曲維持～破壊,やや暗めで激しい四つ打ちトランス。（Black）
LIMBO-54,りんぼごーよん,http://ri-me-me.jugem.jp/,,,Ｂｅｈoｉ＿ｍｅ！,,
link of rayline,りんくおぶれいらいん,http://www.geocities.jp/yazuchi_sueta/,テクノ、エレクトロ、民族、ボーカロイド,,天上アニマ,原曲維持,ソリッドなテクノインストメイン。（和泉）
link of rayline(ヤヅチ工房),りんくおぶれいらいん,http://www.geocities.jp/yazuchi_sueta/,,,「ブレイクダウン・タイフーン」(プレ版),原曲維持,
LION HEART,らいおんはーと,http://shakna.jp/,テクノ、エレクトロ、ロック,,烈華伝O.S.T.,原曲維持,原曲を活かしたシンプルなアレンジ。（Black）
liquid lime-light,りくいっどらいむらいと,http://liquidlimelight.blog137.fc2.com/,ロック,男,through the telescope,原曲重視,シンプルなバンドアレンジ。(イール)
Liset,りせっと,http://magicalinterface.blog79.fc2.com/,テクノ、エレクトロ,女,恋の弾幕ストラックアウト！,原曲維持～破壊,電子音多めな女声ボーカル。（Black）
little white snow,りとるはわいとすのう,http://snow-illusion.com/,エレクトロ、ポップス,女,Last Layer,原曲維持,ポップなボーカルと太めのマルチジャンルアレンジ。（和泉）
Live in Lab,らいぶいんらぶ,http://liveinlab.blog77.fc2.com/,ジャズ、フュージョン,,東方研究所住まい,原曲重視～維持,オール生演奏ジャズアレンジの臨場感。（Black）
Lively Angels,らいぶりーえんじぇるず,http://www.livelyangels.org/,テクノ、トランス,,Shooting Games Arranging Space Vol.01,原曲維持,東方のほかシューティングゲームのゲームミュージックライクなテクノ、トランス寄りインスト。（Black）
Liverne,りヴぁーん,,ダンス、ロック,,東方幻奏祀典,原曲維持,多数のアレンジャーを集めた企画。いい曲揃い。（Black）
Lobgesang,らぶげさん,http://lobgesang.net/,ピアノ、テクノ,,Strumming 春、幻想郷にてピアノをかき鳴らしてみれば,原曲維持,クラシックの技法に忠実に、現代的要素も取り入れたピアノアレンジ。（Black）
Logic Strike ,ろじっくすとらいく,,ボーカロイド、ロック、エレクトロ,,L⇔Rink,原曲維持,ニコ動で活躍する150P氏のボーカロイド系アレンジ。（Black）
logical emotion,ろじかるえもーしょん,http://logical-emotion.com/,ピアノ、アコースティックギター,,Touhou Project acoustic arranged instruments,原曲重視,ニコ動で著名なまらしぃ氏のアコースティック系アレンジ。（Black）
Lolita Comp Records,ろりーたこんぷれこーず,http://lolitacomprecs.at.webry.info/,テクノ、ハードミニマル、シュランツ,,妖精酒乱大戦,原曲破壊,珍しい超極太ハードミニマル系アレンジで脳髄が溶ける。（和泉）
LOOPCUBE,るーぷきゅーぶ,http://loopcube.net/,テクノ、ロック、ポップス,女,lost khara,原曲維持,オリジナルで手堅い技術は東方アレンジでも健在。（Black）
LOST BLESS,ろすとぶれす,http://fancycafe.kachoufuugetu.net/,ダンス、トランス、テクノ,女,東方恋舞想,原曲維持～破壊,明るい表情のダンス風アレンジ。（Black）
Lost Garden ,ろすとがーでん,http://lostgarden.coresv.com/,ワルツ,,Kalanchoe tomentosa,原曲維持,
LOVEマシーン,らぶましーん,,ダンス、トランス,女,iris,原曲重視～維持,基本原曲に近いが雰囲気を活かしたダークな展開も。（Black）
LSD,えるえすでぃ,http://thelucy.blog118.fc2.com/,ロック、バンドアレンジ,男,Lovely Sweet Dreams,原曲維持,エレギ満載のバンド男声ボーカルアレンジ。（Black）
Lunar Gate,るなげーと,,テクノ、エレクトロ,,Transire～東方鋸波奏～,原曲維持,
Lunar Machines,るなましーん,http://milue.fc2web.com/,ダンス、ポップス,,THE UDONGEM@STER,原曲維持,元気いっぱいなポップス寄りアレンジで元気になれる。（Black）
LunarComet,るなーこめっと,http://kstd.net/,テクノ、エレクトロ、ロック,,テクノ・チルノ,原曲維持,正統派テクノから挑戦的なアレンジまで多彩。（Black）
Lunatic Gate,るなてぃっくげーと,http://www.lunatic-gate.net/,ダンス、トランス,,東方舞踏会,原曲維持,スタンダードなクラブ系。（Black）
Lunatic×Bullets,るなてぃっくぶれっつ,,ロック,男,東方弾丸狂,原曲維持,シンプルなロックに素直な男声ボーカル。（Black）
Lunatico,るなてぃこ,http://yaya.fool.jp/,ピアノ,女,少女洋琴倶楽部 Part1,原曲維持,音少なめの端正なピアノアレンジに女声ボーカル。（Black）
LyricalMagical ,りりかるまじかる,http://www.cihiro.net/Lyrical/,,,東方SNAPサウンドエクスパンション,,
Ｌ連.ＮＥＴ,えるれんどっとねっと,http://lucifer.pussycat.jp/,テクノ、エレクトロ,,方楽纂解 -蓮境異聞-,原曲維持,東方とスクウェアを混ぜてアレンジ。（Black）
M.I.W,えむあいだぶりゅー,http://huyutuki.com/,テクノ、ロック、エレクトロ,,Sound Vision ～幻視調律～,原曲維持,多数のアレンジャーによるマルチジャンル。カードゲームイメージアルバム。（Black）
M2indManufactory ,ますたーまいんどまにゅふぁくとりー,http://www.m2ind.com/,テクノ、エレクトロニカ,,昼夜戀歌,原曲維持,BGMに最適な音の少ないエレクトロニカ。しみじみくる。（Black）
