Red Bullet Sequence,れっどぶれっとしーくえんす,http://upupdowndown.sakura.ne.jp/,テクノ、エレクトロ、ヒップホップ,,HelioPhobia,原曲維持～破壊,大胆なアレンジが印象的。（あや）
Red innocence ,れっどいのせんす,,,,Eye Splice ,,
RedGear,れっどぎあー,http://redgear.comli.com/,,,東方レボリューション,,
RegaSound,れがさうんど,http://regasound.com/,ロック,男,Nostalgia,原曲維持,JPOP風本格的ヴォーカルアレンジ。(イール)
Regeneratix,りじぇねれいてぃくす,http://regeneratix.web.fc2.com/,テクノ、トランス、ハードコア,,sky,原曲維持,ダンサブルなトランス系打ち込みアレンジ。東方以外にもゲームミュージックアレンジ。（Black）
Register6,れじすたーしっくす,http://register6.xxxxxxxx.jp/,ロック,男女,空翔ケル妖怪,原曲重視,バンド演奏によるヴォーカルアレンジ。(イール)
Reiche,らいひぇ,http://reiche.seesaa.net/,多重録音アンサンブル,,トラウマロジカル,原曲重視,落ち着いて聞けるリコーダー・ハーモニカ・ギター等の生演奏アレンジ(イール)
RHR,りゅうじんはーとろっく,http://rhr.karakasa.com/,ハードロック、ロック、バンド,男,東方姉妹丼,原曲維持,エレキギターメインのハードめロックアレンジに男声ボーカルががんばる。（Black）
Rhyth.,りず,,ポップス、ロック、エレクトロ,女,東方レボリューション,原曲維持,ＰＳＧ系カラフルアレンジとアップテンポな女性ヴォーカルアレンジ。(イール)
Rhythm of Infection,りずむおぶいんふぇくしょん,http://c80rhythm.web.fc2.com/,ハードコア、トランス、ロック、テクノ,,Rhythm of Infection,,
Riclick,らいくりっく,http://ugajin0041.blog57.fc2.com/,エレクトロ、クラシック,,歪んだ真珠とΑккордеон,原曲維持,音の少ない静かなレトロ成分多めの様々な音遣いインストアレンジ。（Black）
Rico Rico Alice,りこりこありす,http://ricolice.com/,トランス、ハードコア,女,Arificial Sacrifice,原曲維持～破壊,アップテンポなハーコーアレンジ。(イール)
"RIMIT""Z ",りみっつ,http://www.rimitz.com/,ロック,,Move On ,原曲重視,ギターを使ったバンドアレンジ。(イール)
RippleTale ,りっぷるている,http://rippletale.net/,ダンス、トランス,,少女と夢人形,原曲破壊,独自の世界観に基づいた原曲破壊系トランス。アレンジ技術は随一。(イール)
RippleTale ,りっぷるている,http://rippletale.net/,ダンス、トランス,,少女と夢人形,原曲破壊,新曲が聴きたい(´?ω?`)(アルクヴェスタ)
River Mist,りばーみすと,http://www.rimitz.com/,ロック,男,CODE: D,原曲維持～破壊,ギターベースのロックアレンジ。(イール)
River Mist,りばーみすと,http://www.rimitz.com/,メタル,男,Ghost Return to Underground EP,原曲破壊,破壊的デスメタル。（鰻）
Riverside,りばーさいど,http://riverside9.web.fc2.com/,ポップス、ロック、トランス,男女,東方ぱーぷる,原曲維持,
Roar Records,ろあれこーず,http://wint.bms.ms/,トランス,,The Best of Euro-B-Rave,原曲維持,東方アレンジは1曲のみ、徹頭徹尾突っ走るユーロビート。（Black）
RoarAddiction,ろあーあでぃくしょん,http://roaraddiction.mods.jp/,エレクトロ、トランス,,幻想恍惚態,原曲重視,
RoastPorkBrothers,ろーすとぽーくぶらざーず,,ロック、テクノ、エレクトロ、ハウス,男,Delta,原曲維持,元KARMARTのアレンジャーtechi氏の個人サークル。暗めのロックやテクノ、ハウスなどジャンルに囚われない作品。（Black）
Rock Pollution,ろっぽり,http://rpavy.blog2.fc2.com/,ロック,,水質汚染,,ノリよいエレキギターメインのロックインストアレンジ。（Black）
Rocker's step,ろっかーずすてっぷ,http://www.voiceblog.jp/rockersstep/,ガバ、テクノ、ロック,,東方化学反応,原曲維持～破壊,でぃすとーしょんとの合同で大胆なボーカルを合わせたロック。（和泉）
Rococo,ろここ,http://rococo-web.blogspot.jp/,,男女,Beats Per Memory,,
Rolling Contact,ろーりんぐこんたくと,http://youzyo.net/,ハードコア、トランス,,蓮弾円封 -レンダンエンブ-,原曲維持,疾走感のあるハードコアアレンジ。(イール)
ROUGH TIME,らふたいむ,http://www3.ocn.ne.jp/~roughtm/,ポップス、トランス,女,風切る羽音,原曲維持～破壊,ポップなヴォーカルとダークなトランスが対照的。（りず)
ROUTE-ZERO,るーとぜろ,,エレクトロ、ロック、ハウス,,Lost Articles of the Scientific Century ,原曲維持,原曲の雰囲気を活かしてゆったり聞かせるインストアレンジ。（Black）
Ruchi ,るち,http://templa.hide-yoshi.net/,エレクトロ、テクノ、オーケストラ,,風神録六録,原曲維持,
Ruins on the Lotus Position(Drift Orbit),るいんおんざろーたすぽじしょん,http://rolp.sakura.ne.jp/,エレクトロ,,御伽噺オルタナティブ ,原曲重視,原曲に忠実なゆったりとしたアレンジ。(イール)
Ruxia,るしあ,http://ruxia.seeds-9.com/,エレクトロ,,"Flower, Sun, and Moon",原曲破壊,独創的なインストアレンジ。(イール)
rythmique,りとみっく,http://rythmique.mu-sic.jp/rythmique/Welcome.html,ジャズ、ハウス,男女,東方混淆幻楽,原曲維持,スローテンポなアレンジにヴォーカル曲が上手くマッチ。(りず)
s09m,えすまるきゅうえむ,http://s09m.blog42.fc2.com/,メタル,男,Sword of Ghost,原曲重視,重厚なメタルアレンジ。男声ヴォーカルも見事にマッチ。（taspo）
Saga Novel,さーがのべる,http://saganovel.web.fc2.com/,エレクトロ、ポップス,男女,紅魔歌月,原曲維持,しっとりとした音の少なめなアレンジに男女ボーカル。（和泉）
Saiko Logical Airlines,さいころじかるあーとらいんず,http://s-l-a.seesaa.net/,テクノ、エレクトロ,,Eastern Beauty Anthem,原曲維持,起伏は激しくないしっとりとしたダンス系が聴き込める。（Black）
Sakura New Generation,さくらにゅーじぇねれーしょん,http://sakuranewgeneration.blog69.fc2.com/,トランス,,東方電音萃,原曲維持～破壊,徹頭徹尾ハードなトランスで押しまくる。（Black）
salvation by faith records ,さるべいしょんばいふぇいすれこーず,http://sbfr.info/,テクノ、エレクトロ、トランス、ハードコア、アンビエント,,TOUHOU RUSH !! - RushDance in the groove - ,原曲維持,ハードでソリッドな打ち込み系マルチジャンルインスト。（Black）
SANTA MASSACRE,さんたまさかり,http://santamassacre.blog41.fc2.com/,メタル、エレクトロ、ハードコア,男女,1st Demo CD,原曲維持～破壊,男声デスボイス絶叫スクリーモあり軽やかな女声エレクトロポップあり、アレンジは端正。（Black）
Satellite Himawari,さてらいとひまわり,http://satellite.iza-yoi.net/,ロック,男女,States,原曲維持,しっとりとバラード風味のロックボーカルアレンジ。（Black）
SAVE THE QUEEN,せいぶざくいーん,http://savethequeen.ninja-web.net/,ロック、エレクトロ,女,幻想のエリシオン,原曲重視,透き通ったヴォーカルが魅力的。(浅葱)
Scarlatto di Levante ,すかるらっとでぃれヴぁんて,http://mooper.web.fc2.com/,オーケストラ,,Loto Bianco,原曲重視,
Scarlet&Silver,すかーれっとあんどしるばー,http://scarletandsilver.himegimi.jp/,,,Small World,,
schwarzwald ,しゅヴぁるつヴぁると,http://www5.pf-x.net/~schwarzwald/,アンビエント,,Alice in wonderland ,原曲破壊,原曲に独自のイメージを加えたアレンジスタイル。聴く人によって評価分かれるかも。(浅葱)
SCN,えすしーえぬ,http://www.saikoroclub.net/,エレクトロ,男,black history3 - Viridian Label,原曲維持,力強い男性ヴォーカル。(イール)
Scrapyard,すくらっぷやーど,http://scrapyard12.web.fc2.com/,ロック,男,廃獄ララバイ,原曲維持,ロック系アレンジではあるが歌い方はJPOPに近いかも。(麦)
SEA SPARROWS,しーすぱろうず,http://www.sea-spa.jp/,トランス,女,Re:Joiceable Sky,原曲破壊,
Seaside,しーさいど,http://www.seaside-musix.net/,チップチューン,,ぴっこぴこにシテアゲル,原曲維持～破壊,ロックとエレクトロニカの融合。懐かしさを感じるぴこぴこアレンジ。(りず)
Second Fragment,せかんどふらぐめんと,http://secondfragment.cafemix.jp/,アコースティック、ジャズ,,Materialize,原曲重視,鍵盤楽器メインのしっとり系。技巧も高く落ち着いて聞けるアレンジ。(浅葱)
Second Wind Works. ,せかんどうぃんどわーくす,http://www.second-wind-works.com/,,,LO'EUF ,,
Secret Garden ,しーくれっとがーでん,,ピアノ、民族風,女,デイブレイク -daybreak-,原曲維持,ピアノをベースとしたアレンジ。(イール)
Secret Messenger,しーくれっとめっせんじゃー,http://yuyhp.dousetsu.com/,エレクトロ、オーケストラ,女,幻想の境界 - the Garden of phantasmagoria,原曲維持～破壊,アニメサントラ風アレンジ。(イール)
Seele,ぜーれ,,ロック、テクノ、クラシック,,輝夜,原曲維持,全体的に軽やかな曲調のマルチジャンル。（和泉）
Sensitive Heart,せんしてぃぶはーと,http://kt-9.cute.bz/blog/,ロック、ダンス、クラシック,,Scarlet Destiny,原曲重視,原曲重視のよろずアレンジ。ゆっくりとした曲が聞きたい人におすすめ。(イール)
Sensitive Heart,せんしてぃぶはーと,http://kt-9.cute.bz/blog/,"メタル、トランス
",,Scarlet Destiny,原曲重視,聴くと何処か懐かしく、切なさを感じさせる今も衰えぬ事のない名曲ばかり??(アルクヴェスタ)
Sequence Club,しーくえんすくらぶ,http://sequenceclub.oiran.org/,テクノ、トランス、エレクトロ,,Experience,原曲維持,
seven senses,せぶんせんしず,,ロック,男,アヤカシサカセル　－冥界お嬢西行寺 幽々子－,原曲維持,ロックアレンジでの男性ヴォーカル。(イール)
Shadow Children,しゃどうちるどれん,http://www.wind.sannet.ne.jp/shadow_c/,ブラスバンド、ジャズ、オーケストラ,,東方少女応援中,原曲重視,トランペットによるブラスバンド応援風アレンジ。(イール)
SHANGHAI OUTBREAK,しゃんはいあうとぶれいく,,,,デモCD,,
Sharp Eight,しゃーぷえいと,http://sharp-eight.net/,テクノ、ドラムンベース,,  Link ～桜華幻葬～,原曲重視,
ShibayanRecords,しばやんれこーず,http://homepage3.nifty.com/shibayan/,ポップス、エレクトロニカ,女,キセキ☆インパルス～emotionalfeedback,原曲維持,軽快なポップスと電子音溢れるエレクトロニカ。(イール)
SHOEI SOUND,しょーえいさうんど,,テクノ、エレクトロ,,Zevende ShoTime,原曲重視,原曲超重視ではあるが音色やテンポに工夫を加えたマルチジャンルインスト。（Black）
Shu※の作業場,しゅうのさぎょうば,http://mixi.jp/show_friend.pl?id=27781647,テクノ、エレクトロ、ゲームミュージック,,Sunshine shower,原曲維持,ビーマニやポップン風味なアッパー系打ち込みインスト。（Black）
Siestail(Silly Walker),しえすてーる,http://siestail.net/,ポップス、テクノ、電波ソング,男女,かえるさん☆ダ・KERO！,原曲維持～破壊,原曲破壊気味なポップスが多め。技術はアレンジ・ヴォーカルともに大安定。(りず)
SIGN WORKS -UE-,さいんわーくす,http://www.signworksle.com/,テクノ、エレクトロ,,朱羅,原曲重視,ストリングスメインの打ち込み系原曲メロ成分多め。（Black）
Silent Sphere ,さいれんと すふぃあ,http://silentsphere.blog110.fc2.com/,ハウス、テクノ,,Flower,原曲維持,
Silver Forest,しるばーふぉれすと,http://www.silver--forest.com/,ポップス、トランス、電波ソング,女,GRAZE,原曲維持～破壊,オーソドックスから電波ソングまで。最近は女性ヴォーカルアレンジ中心。(イール)
Simple　Equation,しんぷるいくえいしょん,http://simpleequation.xxxxxxxx.jp/,クラシック、アコースティックギター,女,In Wonderland,原曲維持,台湾のアレンジャーによるアコースティック系アレンジに優しい女声ボーカル。（Black）
"Sing, R. Sing! ",しんぐあーるしんぐ,http://www.singrsing.com/,リコーダー・ハーモニカ,,こうまかん☆ぷぺぽー,原曲維持,初等教育風をテーマにした明るく楽しいアレンジ。(イール)
Sinα.com（蒼色科学工房）,さいんあるふぁどっとこむ（あおいろかがくこうぼう）,http://aoirokagaku.iza-yoi.net/,,,Little Vampire Girl,,
Sister's Spread-i,しすたーずすぷれっどまいなすあい,http://minusiyon.exblog.jp/,ポップス、ロック,女,RAIBOW　SPREAD!,原曲維持,整ったポップスとロックアレンジをメインに安定した女声ボーカル。（和泉）
SJV-SC,えすじぇいぶいえすしー,http://odiakes.net/sjv/,ロック、フュージョン,女,Crossing,原曲維持,原曲重視の本格ヴォーカルアレンジ。(イール)
SKETCH　THE　FANTASY,すけっちざふぁんたじー,http://sketchthefantasy.com/,ロック、アコースティック,男,東方穴映画,原曲維持～破壊,下ネタあり真面目ありのギター系ロック。（Black）
skynat ,すかいなっと,http://sky-nat.seesaa.net/,エレクトロ、ロック,男,モノクロノゲンソウキョク,原曲維持,ロック風味のシンプルな味付けに男声ボーカル。（Black）
slic,そりっく,http://orphicaluminous.posterous.com/,,,"There are not any colors, not any words, not any b.g.m",,東方風オリジナル。(麦)
SLM-music,えすえるえむみゅーじっく,http://slmmusic.s175.xrea.com/,アコギ,,Hetare TOHO Music side:G vol.2β,原曲重視,ギターソロでのゆったりとした演奏。(隆)
Smalt Erz,すまるとえるつ,http://smalt-erz.mistysky.net/,クラシック、ピアノ,,幻想郷 ～ Classicalized Scenery.,原曲維持,クラリネット・ピアノ等を使った生演奏クラシックアレンジ。(浅葱)
Smalt Erz,すまるとえるつ,http://smalt-erz.mistysky.net/,クラシック、オーケストラ、ピアノ,,空想小路へようこそ,原曲維持,ＦＦシリーズを想起させるゆったりとしたクラシックアレンジ。（鰻）
SmartCore(uisceky),うぃすきー,http://uisckeyworks.blog104.fc2.com/,,,OLD FITZGERALD,,
"Smile, Baby, Smile",すまいるべいびーすまいる,http://smilebabysmile.jp/,トランス、エレクトロ、ハウス、ピアノ、アンビエント、エレクトロニカ、ゲームミュージック,女,"Smile, Baby, Smile",原曲維持,コンプアルバム。様々なジャンルがあり聞き応えがある。(UR)
SMOKESTACK,すもーくすたっく,http://smokestack.blendmix.jp/,エレクトロ,,Cadaverous Bloom,原曲破壊,
Snow*Mark ,すのうまーく,http://notes.soragoto.net/,ドラムンベース、ブレイクビーツ,,Party Time LP,原曲維持,非４つ打ちのクラブ系アレンジ。(イール)
SNUG SPACE,すなぐすぺーす,http://snugspace.jugem.jp/,フュージョン、ジャズ,,SPARKING GIRL,原曲維持,サックスがしんみりと、ピアノも元気。（Black）
sociopath,そしおぱす,http://sociopath98.blog50.fc2.com/,ロック,女,東方玄冬簾～snow stays through the blind～,原曲維持,
solid state supernova,そりっどすてーとすーぱーのば,http://www.s3n-music.com/Top.html,ロック,男女,PLAYMATE,原曲維持,
Sonic Hybrid Orchestra,そにっくはいすぴーどおめが,http://sound.jp/s-h-omega/,メタル、オーケストラ,男女,TOHO Tempestシリーズ,原曲維持,疾走感の有るメタルとシンフォニックなオーケストラの融合。(イール)
sonitus plasmator,そにとぅすぷらすまとる,http://gramsonipla.koborezakura.com/,ポップス、ロック,女,早風星夜,原曲重視～原曲維持,ボーカルを押し出した音少なめなポップス風アレンジ。（Black）
sophia design,そふぃあでざいん,,テクノ、エレクトロ,,東方妙々編楽曲,原曲維持,ミドルテンポのシンプルなビートとテクノ風電子音はBGMにいい。（和泉）
sou1,そういち,http://sou1wp.s1224.com/,テクノ、エレクトロ、トランス、ハウス,,FORBIDDEN GOTTA,原曲維持,ドラムの刻みがかっこいいハウス系です。（和泉）
Sound 01 ,さうんどぜろわん,http://efs.holy.jp/REI7/,ロック、ポップス,女,Phantom,原曲重視,efsとLike a rabbitのコラボサークル。両サークルのヴォーカル曲がメイン。(浅葱)
Sound and Vision,さうんどあんどヴぃじょん,http://soundandvision.web.fc2.com/index.htm,,,東方風林火山,,
Sound Barrage,さうんどばらーじ,http://www.sound-barrage.com/,テクノ、エレクトロ、トランス,女,BEYOND THE DOOR,原曲維持,激しくダーク、ダンサブルなシンセ。（和泉）
Sound Bullet Hell,さうんどばれっとへる,http://s-b-h.syncl.jp/,ロック,男,CRIMSON BULLET HELL,原曲重視,原曲重視の生演奏バンドアレンジ。(浅葱)
Sound Crew -I'll-,さうんどくるーあいる,http://soundcrewill.web.fc2.com/,,,Oriental Grooveシリーズ,,
Sound CYCLONE,さうんどさいくろん,http://cyclone.main.jp/,ロック、ポップス、ジャズ、R&B,男女,feat.RIZE,原曲維持～破壊,よろずアレンジに生演奏＋ヴォーカルを織り交ぜる技術が光る。(イール)
Sound CYCLONE,さうんどさいくろん,http://cyclone.main.jp/,ロック、ポップス、ジャズ、R&B,男女,feat.RIZE,原曲維持～破壊,クラブ系～ロックまで様々なサウンドが特徴！インストもヴォーカルもこなします。（瑞葉）
Sound Escape,さうんどえすけいぷ,http://sound.jp/soundescape/,ハウス、オーケストラ、ピアノ,,東方春幽記,原曲重視,ゆったりとしたオーケストラが多め。(浅葱)
SOUND HOLIC ,さうんどほりっく,http://www.sound-holic.com/,ポップス、ロック、ジャズ、ピアノ,女,SOUND HOLIC MEETS TOHOシリーズ,原曲重視～維持,マルチジャンルをこなす本格派サークル。ヴォーカルアレンジも安定。（イール)
SOUND OCTA,さうんどおくた,http://www.sound-octa.net/,エレクトロ、オーケストラ,,東方幻星録,原曲重視,荘厳なオーケストラアレンジが特徴的。(イール)
Sound Online ,さうんどおんらいん,http://soundonline.info/,トランス,女,Blue Constellations,原曲維持,透明感のあるトランスアレンジ。(イール)
sound sepher,さうんどせふぁー,http://sepher.jp/,ロック、メタル、トランス,,Cradle - 東方幻樂祀典,原曲維持,合同企画CDの先駆者。正統派アレンジが多く外れなし。(イール)
Sound　Square,さうんどすくえあ,http://soundsquare.blog31.fc2.com/,テクノ、トランス、ハードコア,,FragmentS,原曲維持～破壊,スタンダードな四つ打ち系少しハード目。（Black）
SOUND TRIBUTE,さうんどとりびゅーと,http://soundtribute.web.fc2.com/,ポップス、民族、ボーカロイド,女,東方新涼歌,原曲維持,そこはかとなく郷愁を感じさせるメロディに乗せた女声ボーカルやボーカロイド。（Black）
SOUND UNiSON NEST,さうんどゆにぞんねすと,http://soundunison.iza-yoi.net/,ロック、ポップス,男女,悠久の記憶,原曲重視,
Sound./Ecriture,さうんどえくりちゅーる,http://sound-ecriture.com/,オーケストラ、ポップス、テクノ,女,Fantasia～幻想郷幻奏曲,原曲維持,
Sound.AVE,さうんどあべにゅー,http://soundave.net/,テクノ、ハードコア、オーケストラ,女,Raven Inscribe,原曲重視,スピード感の有るテクノアレンジがメイン。(イール)
Sound∞Infinity,さうんどいんふぃにてぃ,http://soundinfinity.iza-yoi.net/,ハードコア、トランス,女,Conclusion,原曲維持,ハイテンションな４つ打ちアレンジ(浅葱)
SoundArk,さうんどあーく,http://soundark.jimdo.com/,テクノ、ドラムンベース、ジャズ、エレクトロニカ、クラシック、ロック,,東方音箱舟参,原曲維持,複数アレンジャーによる軽めのマルチジャンルインストアレンジ。（Black）
SoundChaos,さうんどかおす,http://soundchaos.symphonic-net.com/,トランス、テクノ、ハードコア,,"TEC BOX Ex.2 ～ ""Triple Time Party!!"" ",原曲維持～破壊,面白い３つ打ちサウンド。（浅葱)
SoundRefil,さうんどりふぃる,http://soundrefil.main.jp/home.html,ロック、トランス、エレクトロ,,CrimsonVioret,原曲重視,
Sounds of Liberation,さうんどおぶりべれーしょん,http://www.s-liberation.net/,チップチューン,,Monochrome Anachronism,原曲重視,ファミコン・ゲームボーイなどの懐かしいチップチューンアレンジ。(イール)
"SoundTeam,LORB",さうんどちーむえるおーあーるびー,http://www.lorb.info/,テクノ、エレクトロ、チップチューン,,Little Wonderland,原曲重視,
SOUTH OF HEAVEN,さうすおぶへぶん,http://s-o-h.jp/,ヘヴィメタル、ハードロック,,東方鋼鉄魔,原曲維持,7弦ギターによる重厚感に満ちたヘヴイメタアレンジ。(イール)
Soy-SOUTH,そいそーす,,ロック,男女,珀蘭藍花,原曲維持,和風ロックアレンジ。ギター、ドラムと和楽器・ヴォーカルが見事に融合。(りず)
Spielraum,しゅぴーるらおむ,http://www.freiheitlichraum.net/,トランス,女,Spielraum,原曲維持,シンプルなトランスアレンジ。(浅葱)
Spiral Music,すぱいらるみゅーじっく,http://spiralmusic.sakura.ne.jp/,テクノ、エレクトロ,,Blue Lycoris,原曲維持～破壊,
springmist,すぷりんぐみすと,http://spmis.web.fc2.com/,コーラス,男女,東方紅夜祭～the Scarlet Harmony Festival～,,
Sprite Wing,すぷらいとういんぐ,http://spritewing.com/,ロック、ポップス,女,幻想郷の星雨日和,原曲重視,アップテンポな女性ヴォーカル曲メイン。(イール)
S-STYLE,えすすたいる,http://homepage2.nifty.com/s_style/top2.htm/,ダンス、ハウス、トランス,,花映　～はなうつり～,原曲重視,原曲重視のよろずアレンジ。(イール)
starlight garden,すたーらいとがーでん,http://www.kuronowish.com/~blue-meadow/,クラブ,,Scarlet House,,
StarSky,すたーすかい,http://tohochaosmix.xxxxxxxx.jp/tcm_index.html,テクノ、エレクトロ、ロック、ハードコア、オーケストラ、アカペラ,,TOHO CHAOS MIX,原曲維持,それぞれのジャンルでスタンダードなスタイルのマルチジャンルインストと思いきや最後の全部声アカペラでカオス。（Black）
STEP×STEP,すてっぷすてっぷ,http://jomyda13.kirisute-gomen.com/,トランス、ロック,女,東方魂花～The first acceleration～,原曲維持～破壊,
STORY,すとーりー,,,,CHERRY,,
Stratiotes,すとらてぃおーてす,http://mrsweden.com/,メタル,男,Abstract,原曲破壊,原曲破壊のデスメタルボーカルアレンジ。まさに絶叫。(隆)
Stratosphere,すとらとすふぃあ,,ロック、民族,,純情横恋慕,原曲重視,軽快なリズムの安定したアレンジ。（浅葱)
Stratosphere Glider,すとらとすふぃあ　ぎるだー,http://sound.jp/sglider/,トランス,,Stratosphere Glider ,原曲維持,
strobo head,すとろぼへっど,http://strobohead.nobody.jp/,ロック,,stroboregister,原曲重視,気合の入った男性ヴォーカル。（浅葱)
Studio *.izumi,すたじおいずみ,http://izumism.com/index.html,テクノ、トランス、ロック,,残夏,原曲維持,透明感のあるよろずアレンジ。(浅葱)
Studio “Syrup Comfiture” ,すたじおしろっぷこんふぃちゅーる,http://www.syrufit.jp/,ロック、トランス、エレクトロ、アンビエント,女,Double Counterpoint,原曲破壊,女性ヴォーカルメイン。歌唱力は高いがかなり原曲破壊気味。(浅葱)
Studio de la musique H,すたじおでらむじーくえいち,http://haradamusic.web.fc2.com/,テクノ、エレクトロ、ポップス、ロック,男女,東方Vocal1,原曲維持,いろいろな音を使ったマルチジャンルボーカルアレンジ。（Black）
Studio H.E.X.,すたじおへくす,,テクノ,,人形遣いの夜,原曲維持～破壊,スローテンポなアンビエントテクノアレンジ。(浅葱)
Studio K.N.S. ,すたじおけーえぬえす,http://studiokns.web.fc2.com/Studio_K.N.S./HOME.html,テクノ,,Blooming Apparitions,,
Studio YKK,すたじおわいけーけー,http://d.hatena.ne.jp/studioykk/,テクノ、トランス,,Be insane.,原曲維持,
StudioENTRY,すたじおえんとりー,http://studioentry.web.fc2.com/,,,名無しのCD,,
Stygian Riverside,すてぃじゃんりばーさいど,http://stygian-riverside.at.webry.info/,ハードロック、ヘヴィメタル,,A Tribute to the East Vol.2,原曲維持,スタンダードなHR/HM。(浅葱)
STYLE.S,すたいるえす,,ロック,,東方紅月魂,原曲重視,
